name,formattedAddress,lat,long,photoReference,placeID,rating,userRatingsTotal,cityType,cityName,compoundCode,types,hiddenGems,ticketStatus,budget,category,userType,openHours,closeHours,closeDays,description,access,activity,facility,suggestion
Museum Gedung Sate,"Jl. Diponegoro No.22, Citarum, Kec. Bandung Wetan, Kota Bandung, Jawa Barat 40115, Indonesia",-6.902637899999999,107.619169,ATJ83zimpME7tPZ7kdZ29qfuxzdmXib5AtnD_vmbtM19alIz8ElAvTl7S83c8HLqLR-pOq2-iJUYB4TgCBxO91t2kF0tlYR3KEN2TfZKZ_IH46tbsSicz7BTcjdP24LK3d-CBXiHGi5MTB-jPvPce_FsIdHGT6sqsKjFXkgnf6dyNDLLEiyc,ChIJBQDhekvmaC4R3MRV_8MI6fQ,4.7,2544,kota,KOTA BANDUNG,"3JW9+WM Citarum, Bandung City, West Java",tourist_attraction|museum|point_of_interest|establishment,No,Yes,Low,Edukasi|Relaxing|Historical,Solo|Friends|Couple|Family,09.30,16.0,Monday,"Gedung Sate adalah bangunan bersejarah yang dibangun pada tahun 1920-an dan dulu digunakan sebagai markas pemerintahan Hindia Belanda. Bangunan ini terkenal karena memiliki menara yang menyerupai tusuk sate, sehingga namanya. Museum Gedung Sate berfungsi untuk menjelaskan sejarah dan budaya Kota Bandung, serta memberikan wawasan tentang arsitektur khas Hindia Belanda. Anda dapat menikmati koleksi foto, artefak, dan pameran yang menjelaskan peran penting bangunan ini dalam sejarah kota.","Museum Gedung Sate terletak di pusat Kota Bandung, di Jalan Diponegoro No. 22, Jawa Barat, Indonesia. Anda dapat menggunakan transportasi umum seperti taksi atau angkutan umum dari hampir semua wilayah di Bandung. Jika Anda berkendara sendiri, tersedia area parkir di sekitar museum.",Berkeliling museum untuk melihat pameran sejarah dan arsitektur.Mempelajari sejarah Kota Bandung dan perannya dalam perkembangan Indonesia.Menikmati arsitektur klasik dan taman yang indah di sekitar museum.Berfoto di depan Gedung Sate yang ikonik.,Area parkir.Toilet.Area istirahat.Pemandu wisata.,"Pastikan membawa kamera karena Gedung Sate sangat fotogenik.Periksa jam operasional sebelum mengunjungi, dan pastikan Anda datang saat museum buka.Gunakan pemandu wisata jika Anda ingin mendapatkan wawasan yang lebih mendalam tentang sejarah Gedung Sate."
Museum Konferensi Asia Afrika,"Jl. Asia Afrika No.65, Braga, Kec. Sumur Bandung, Kota Bandung, Jawa Barat 40111, Indonesia",-6.921237,107.6095853,ATJ83zjWnSIxkSZIe5g7SPq7jElixfI1GS5YMaYvhNnRhz1Y0n3LuPoFn1AQmDt9KFreYvRsgMwh9bAdCZWT1bn1z40qtnqPU9R427IwRo_3noakD9qh1mmwukFb5qOJpDgC1JTkz8TBB0ynmTZcJoJnuV0iwIasSkGhnUsRzVPvmt1W0xRC,ChIJT5aRFS_maC4RcqQgi-wwFu0,4.7,10317,kota,KOTA BANDUNG,"3JH5+GR Braga, Bandung City, West Java",tourist_attraction|museum|point_of_interest|establishment,No,No,Low,Edukasi|Relaxing|Historical,Solo|Friends|Couple|Family,09.00,23.0,-,"Museum Konferensi Asia Afrika (Museum KAA) di Bandung adalah sebuah situs bersejarah yang memiliki akar dalam Konferensi Asia Afrika tahun 1955. Museum ini menjadi tempat bersejarah di mana Bendera Asia Afrika pertama kali dikibarkan dan Deklarasi Kemitraan Asia Afrika ditegakkan untuk mewujudkan masa depan yang lebih baik. Diresmikan oleh Presiden Republik Indonesia, Soeharto, pada 24 April 1980, museum ini memperingati peristiwa penting ini dan menjadi simbol dari 25 tahun Konferensi Asia Afrika.","Museum ini terletak di pusat Kota Bandung, sehingga mudah dijangkau dengan berbagai jenis transportasi. Anda dapat menggunakan taksi, ojek, atau angkutan umum untuk mencapai museum. Alamatnya: Jl. Asia Afrika No. 65, Kota Bandung, Jawa Barat.","Anda dapat mengikuti tur museum, melihat koleksi bersejarah, dan belajar tentang peran penting yang dimainkan oleh Konferensi Asia Afrika dalam sejarah diplomasi internasional. Anda juga bisa menikmati taman sekitar dan pemandangan bangunan bersejarah di sekitarnya.",area parkir. pemandu wisata.Toilet.,"Pastikan untuk membawa kamera atau ponsel pintar Anda untuk mengabadikan momen di museum ini.Luangkan waktu untuk mendengarkan cerita pemandu wisata jika tersedia, karena ini akan membantu Anda memahami sejarah konferensi dan koleksi museum dengan lebih baik."
Museum Mainan,"No., Jl. Sunda No.39, Kb. Pisang, Kec. Sumur Bandung, Kota Bandung, Jawa Barat 40112, Indonesia",-6.920031,107.6176703,ATJ83ziNAHR_UJFWTLNJWaAAGAbY17SEZWi1UI1dRQEKISfFlKD0mzQjfmoCoDKNFocUJU5V0vGtjJLGZ8TDE7enBQeooAjUHS35UCUCXKnfE_1MVh6jWPlG0wqcqBc1EVzjrGCrT4EFaz9vncoLPhOCj7k2DjIl1x3MuFq31mZOzZi3KzP6,ChIJbQGEsi3maC4RSqVznBsUne0,4.3,67,kota,KOTA BANDUNG,"3JH9+X2 Kebon Pisang, Bandung City, West Java",tourist_attraction|point_of_interest|establishment,No,No,Low,Historical|Edukasi,Solo|Friends,08.00,19.0,-,"Museum Mainan Bandung adalah tempat yang menyajikan koleksi mainan klasik dan modern dari berbagai era. Anda akan menemukan berbagai jenis mainan, mulai dari boneka, action figure, hingga permainan elektronik. Museum ini memberikan wawasan unik tentang sejarah permainan dan mainan yang pernah ada.","Berlokasi di Jalan Sunda No. 39A, museum ini sangat dekat dari perempatan Jalan Veteran arah Jalan Sunda.",Anda dapat menjelajahi berbagai ruangan yang dipenuhi mainan.,area parkir.toilet.,Disarankan untuk datang selama hari biasa untuk menghindari keramaian. Pastikan kamera Anda siap untuk mengabadikan momen dengan mainan yang menarik. 
Panghegar Waterboom,"Jl. Mengger Tengah No.37, Mengger, Kec. Bandung Kidul, Kota Bandung, Jawa Barat 40252, Indonesia",-6.961403199999999,107.6227321,ATJ83zhcCzsUYjXIm4S80jOiZWJCjY5y3B3xsfHvC9XTIWAkkzh-ab-8o7wwC1Mus8n7h9U6dJqWFhybE7U-9evi9ObiRomkz_4JeWWILtZkXGAETiPX9jDXxGLFYiyc-SQbYVfx7Npgkrj6gcegsv66rGgf3e0HhytccLpT91Hfk8ta4Y5D,ChIJkwl70Z3oaC4ROmVnP8rCudw,4.3,4814,kota,KOTA BANDUNG,"2JQF+C3 Mengger, Bandung City, West Java",amusement_park|tourist_attraction|point_of_interest|establishment,No,Yes,Medium,Entertain,Solo|Friends|Couple|Family,08.00,17.0,-,"Panghegar Waterboom adalah taman air yang luas dan menawarkan berbagai wahana air yang seru untuk keluarga dan teman-teman. Terletak di tengah kota Bandung, tempat ini merupakan tempat yang sempurna untuk bersantai dan bersenang-senang. Anda akan menemukan kolam renang dengan air mengalir, seluncuran air, dan berbagai wahana seru untuk semua usia.","Wisatawan dapat mencapai Panghegar Waterboom dengan menggunakan transportasi umum yang memiliki rute Kebon Kalapa - Mengger, dan kemudian meminta untuk berhenti di depan Panghegar Waterboom. Alternatif lain adalah menggunakan transportasi umum yang melewati Jalan Sukati, berhenti di seberang Jalan Pasirluyu, dan melanjutkan perjalanan dengan angkutan Kebon Kalapa - Mengger.",Berenang di kolam renang.Menikmati seluncuran air yang menegangkan.Menyantap makanan dan minuman di food court yang tersedia.,Kolam renang.Seluncuran air.food court.Area parkir.Area bermain.Kolam Air Panas.,Pastikan Anda memakai pakaian renang dan membawa perlengkapan seperti handuk dan sunscreen.Datang lebih awal untuk menghindari antrian yang panjang.Bawa uang tunai untuk pembayaran di tempat.Periksa jadwal dan harga tiket terbaru sebelum pergi.
Peta Park,"Jl. Peta No.229, Suka Asih, Kec. Bojongloa Kaler, Kota Bandung, Jawa Barat 40242, Indonesia",-6.9317951,107.5883026,ATJ83zha1WXL45f9wc1rxhfzVhJ3V55_fpc9Kur3dOQPbYj4BP_UR7dRyEr3vFWCLFAc7UvwSOaQtY4OeRRujCPuWYX3h3v3IUmr2GfiWKtG7feQKg3NnWJ6DdxjaHxsy5h1CMTHt7Pye4GGcJrtJ-Uwf5fwwcVk6e1psB_WED_pnQc1HHzM,ChIJcd4jrKfoaC4RpokEfBFEQM0,4.4,4869,kota,KOTA BANDUNG,"3H9Q+78 Suka Asih, Bandung City, West Java",tourist_attraction|park|point_of_interest|establishment,No,Yes,Low,Nature|Relaxing|Kuliner,Solo|Friends|Couple|Family,07.00,19.0,-,"Peta Park di Kota Bandung, Jawa Barat, adalah destinasi wisata berupa taman luas dengan desain yang bersih, modern, dan minimalis. Diperkenalkan pada tahun 2016, hingga saat ini, taman ini tetap menjadi salah satu tempat liburan yang paling populer dan disukai di Kota Bandung.","Taman Lalu Lintas berlokasi di pusat Kota Bandung, dan mudah diakses dengan alamat lengkap di Jalan Peta No.229, Suka Asih, Bojongloa Kaler, Kota Bandung. Lokasi ini sangat strategis, memungkinkan pengunjung untuk sampai ke sana dengan mudah menggunakan kendaraan pribadi atau transportasi umum.",Wisata Petik Sayur.WIsata kuliner.berfoto di spot foto yang sudah disediakan.Menikmati pemandangan taman.,Spot Foto.Tempat Bersantai.Skywalk.Tempat parkir.Area kuliner.,Datanglah saat cuaca cerah untuk menikmati aktivitas di luar.Jangan lupa untuk menjaga kebersihan taman dengan membuang sampah pada tempatnya.Perhatikan jam buka dan tutup taman.Bawa kamera untuk mengabadikan momen berharga Anda.
Photography Park of Bandung,"Jl. Kemuning No.4, Merdeka, Kec. Sumur Bandung, Kota Bandung, Jawa Barat 40113, Indonesia",-6.9134744,107.6271387,ATJ83zgiuub728qQq4Q_389ScaKFitqYWnshsguX4k7igL7lYXdP9V3-PdzL6qJhaRKCdFkuhnXXV-rVlGzlP7R012vVHvbPhEvAB_-Dxfe9zmT7rrVPCLMO7Cn1DZMFt65AKtT6AXQOAMNlGQft7z054ZM1VoUpD0kREGMg-1r15rRLaV_3,ChIJZ3K4JsznaC4RaLxhKq_Cnp8,4.4,3275,kota,KOTA BANDUNG,"3JPG+JV Merdeka, Bandung City, West Java",tourist_attraction|amusement_park|park|point_of_interest|establishment,No,No,Low,Nature|Relaxing,Solo|Friends|Couple|Family,00.00,23.59,-,Photography Park of Bandung adalah area terbuka yang sering digunakan masyarakat untuk mengajak anak-anaknya bermain.karena taman ini memiliki banyak permainan dan memiliki ruput sintetis.,"Alamat Jl. Kemuning No. 4, Merdeka, Sumur Bandung, Kota Bandung, Jawa Barat 40113 dapat diakses dengan kendaraan pribadi, taksi, atau ojek daring dari pusat kota Bandung, Stasiun Bandung, atau Terminal Leuwi Panjang. Gunakan peta atau GPS untuk panduan lebih lanjut.",Beristirahat sanbil menikmati pemandangan.Bermain bersama keluarga.Berpiknik.,area bermain.rumput sintetis.Pedagang .Tempat parkir.,Sebaiknya datang pada pagi atau sore hari untuk cahaya terbaik saat mengambil foto.Jangan lupa membawa bekal dan air minum jika Anda berencana untuk menghabiskan waktu lebih lama.
Plaza Cikapundung River Spot,"3JH5+XG9, Jl. Dr. Ir. Sukarno, Braga, Kec. Sumur Bandung, Kota Bandung, Jawa Barat 40111, Indonesia",-6.9200921,107.6088457,ATJ83ziEOwyePHHK7Cciwna4BmWkLA5TGwwpMRT1DfPC1Qhixt_eVth6_29WS6aQEYifO1wYuI_e8lBqTUPu00u_k2RxMgGg2u4zwV4WG5NV8oyHbLCOZA25aOtkf0uSn5ADHxeAJIJOodE4Ve34NZIfK4OpQQYTsUfdz6ejIOjDnLTx7g1I,ChIJSZh4eiXmaC4RAUPOmyG32uk,4.3,5104,kota,KOTA BANDUNG,,tourist_attraction|park|point_of_interest|establishment,No,No,Low,Relaxing,Solo|Friends|Couple|Family,00.00,23.59,-,"Plaza Cikapundung River Spot adalah tujuan wisata populer di Kota Bandung, sering kali dikunjungi oleh para pengunjung yang ingin mengabadikan momen indahnya. Terletak tepat di sepanjang sungai Cikapundung yang menenangkan, tempat ini menampilkan air mancur yang menari dengan cahaya berwarna-warni pada malam hari, menciptakan daya tarik khusus yang memikat hati para pengunjung.","Jika Anda memiliki kendaraan pribadi, Anda dapat menggunakan GPS atau peta offline untuk mencapai alamat Plaza Cikapundung River Spot: Jl. Dr. Ir. Sukarno, Braga, Kec. Sumur Bandung, Kota Bandung, Jawa Barat 40111. Pastikan untuk memeriksa peta sebelum pergi.",duduk santai sambil menikmati pemandangan.Berpiknik.,Tempat duduk.Air mancur.Tempat parkir.,Datang pagi atau sore untuk menghindari panas berlebihan.
Pustaka Bunga Kandaga Puspa Park,"Jl. Citarum No.23 A, Citarum, Kec. Bandung Wetan, Kota Bandung, Jawa Barat 40115, Indonesia",-6.903319799999999,107.6225052,ATJ83zhcLf-0R8JShscXCU0krt4M0fPRsR9BjfMT74rlIE64jLs5D_APoZaBjQuUwag3eJZ2-XTsXbP3xxf3nc0XuHG3XpQBCxo5WNZnW-RlOLvTxyj3_tbmV0EnKYgRUX9nm9y3wPoy5Wj1v5GBsLu2Mxs8KxjScH14Qq1mspRVUO26ZeRI,ChIJTde0wbTnaC4RGpHYIfWF3UQ,4.3,1395,kota,KOTA BANDUNG,"3JWF+M2 Citarum, Bandung City, West Java",tourist_attraction|park|point_of_interest|establishment,No,No,Low,Nature|Relaxing,Friends|Family,08.00,16.3,-,"Taman Pustaka Bunga Kandaga Puspa, sebelumnya dikenal sebagai Taman Cilaki, telah ada sejak 30 Desember 2013. Taman ini mengalami revitalisasi dan perubahan besar dari kondisi awalnya yang kurang terawat dan angker. Kini, taman ini telah menjadi Ruang Terbuka Hijau yang indah dengan tanaman beragam dan bunga-bunga yang menarik.","Lokasinya yang terletak di pusat kota Bandung merupakan keunggulan tersendiri karena akan mempermudah akses bagi Anda, terutama jika Anda membawa kendaraan pribadi. Hanya dengan melihat peta di atas, Anda dapat dengan mudah menggunakan GPS untuk mencapai taman yang indah ini.",bisa membeli aneka tanaman dan bunga lengkap dengan perabotan pelengkapnya.Menikmati keindahan taman bunga.Taman ini adalah surga bagi para pecinta fotografi dengan pemandangan yang indah.Mengenal berbagai macam bunga.,Area parkir.Toilet.Free WIFI.Green Area.,Datanglah saat pagi atau sore hari untuk menghindari terik matahari.Jangan merusak atau memetik bunga-bunga atau tanaman di taman.Pastikan untuk membuang sampah pada tempatnya.
Rainbow Garden Lembang,"5JJ9+R9H, Lembang, West Bandung Regency, West Java 40391, Indonesia",-6.8179384,107.6184862,ATJ83zgW0TU4VPh9QaNG8q9OwrEsWvpvBgG_w_OaR2JCt9x9LIoOn1GZ8jM509rc3t93f9hvieuuJNc3tz_QVUYsU9DNIFm77kc-ujKTxFrxIcrP5lDddf6G4J_ort0403NYJ_vzunTKt57EK8-SyUxW8FKlO5lOFPweWOSatjnCJk3CHRQ,ChIJyx50QBzhaC4RpD272wo6oTI,4.6,3775,kota,KOTA BANDUNG,,park|tourist_attraction|point_of_interest|establishment,No,Yes,Medium,Nature|Relaxing|Perbelanjaan|Kuliner,Solo|Friends|Couple|Family,09.00,18.0,-,"Rainbow Garden Lembang adalah taman bunga yang indah dan penuh warna terletak di Lembang, Bandung. Tempat ini memiliki berbagai macam bunga yang cantik, menghadirkan pemandangan yang memesona, dan sangat cocok untuk bersantai serta berfoto-foto.","Rainbow Garden Lembang terletak di Jl. Maribaya No. 120, Lembang, Kabupaten Bandung Barat, Jawa Barat 40391. Jika Anda memiliki mobil pribadi, gunakan GPS untuk perjalanan sekitar 1 jam dari Bandung. Alternatifnya, gunakan angkutan umum ke Lembang dan kemudian naik taksi atau ojek online ke taman ini. Jika Anda menginginkan perjalanan yang terorganisir, pertimbangkan paket tur wisata dari agen perjalanan Bandung. Pastikan untuk memperhatikan lalu lintas, terutama di akhir pekan, dan gunakan GPS atau peta untuk navigasi yang tepat.",Mengunjungi Green House.Belanja Tanaman & Bunga.Melihat Tanaman ,lahan parkir. toilet. mushola. tempat makan.,Sebaiknya datang di pagi hari atau hari kerja untuk menghindari keramaian.Pakailah pakaian yang nyaman dan berhati-hati saat berjalan di sekitar kebun bunga.
Sungai Cikapundung,"4J34+QGF, Bandung, Tamansari, Bandung Wetan, Bandung City, West Java, Indonesia",-6.8955582,107.6062941,,ChIJAdv3JQHnaC4R6Zi7BlLRS4k,5.0,1,kota,KOTA BANDUNG,,tourist_attraction|point_of_interest|establishment,No,No,Low,Nature|Relaxing,Solo|Friends|Couple|Family,00.00,23.59,-,"Sebelumnya, Teras Cikapundung Bandung adalah daerah yang tidak terawat dan kumuh, tetapi telah mengalami transformasi menjadi destinasi wisata. Cikapundung adalah sungai yang memotong kota Bandung, berawal di utara kota dan mengalir hingga ke selatan sebelum bergabung dengan Sungai Citarum.","Akses ke Teras Cikapundung Bandung mudah melalui mobil, motor, angkutan umum, ojek online, atau berjalan kaki. Pastikan untuk memeriksa peta atau aplikasi transportasi jika diperlukan.","berjalan-jalan santai. berpiknik di tepi sungai. Juga terdapat banyak spot foto menarik dan taman-taman kecil. Beberapa orang juga menyukai kegiatan bermain air di sungai ini, meskipun sebaiknya pastikan untuk mematuhi peraturan keamanan.",Amfiteater.Jembatan merah.Air mancur.Kolam ikan.,"Disarankan untuk datang ke Sungai Cikapundung pada pagi atau sore hari untuk menghindari cuaca yang terlalu panas. Juga, jangan lupa membawa air minum, topi, dan perlindungan matahari jika Anda merencanakan kunjungan panjang. Pastikan untuk menjaga kebersihan dengan membuang sampah pada tempatnya."
Taman Balai Kota Bandung,"Jl. Wastukencana No.2, Babakan Ciamis, Kec. Sumur Bandung, Kota Bandung, Jawa Barat 40117, Indonesia",-6.9128301,107.6097488,ATJ83zixRY5AEeSqiPk62JEeLnxYsmpTgso5-dyEzZqOppGUmuq2t-JFYnPDjtNqklo_rbhQ7ngtLUhiIoxiLGJ9vaqpzWhNnYyPCedmALdqcgaEgomWeyFFoxYMiAmRKNd4V3srHB7Og5SEvXGEhheq0X99enycFMJpG4CCN2kCSAEc11eG,ChIJ7beirjDmaC4RRLGgheAdScg,4.6,10637,kota,KOTA BANDUNG,"3JP5+VV Babakanciamis, Bandung City, West Java",tourist_attraction|park|point_of_interest|establishment,No,No,Low,Relaxing,Solo|Friends|Couple|Family,00.00,23.59,-,"Taman Balai Kota Bandung adalah taman yang luas dan indah yang terletak di pusat kota Bandung. Taman ini memiliki beragam kebun bunga, jalur setapak yang asri, dan area bermain anak-anak. Bangunan Balai Kota yang megah juga menjadi daya tarik tersendiri.","Anda dapat menggunakan kendaraan pribadi atau transportasi online untuk mencapai taman ini. Bandung memiliki peta yang baik, jadi navigasi akan mudah.","Nikmati keindahan taman dengan berjalan-jalan santai di antara kebun bunga yang cantik.Area bermain anak-anak tersedia untuk keluarga yang membawa anak kecil.Taman ini menawarkan lanskap yang indah untuk berfoto-foto, terutama di sekitar Balai Kota yang megah.Anda bisa membawa bekal dan bersantai di salah satu area piknik yang disediakan.",Tempat sampah.Tempat duduk.Area bermain.spot foto.,"Pastikan untuk membawa kamera atau ponsel cerdas Anda untuk mengabadikan momen-momen indah di taman ini.Kenakan pakaian yang nyaman dan sesuai dengan cuaca, serta sepatu yang cocok untuk berjalan.Jika Anda datang bersama keluarga, pastikan anak-anak Anda selalu dalam pengawasan."
Taman Braga,"Jl. Ustadz Abdul Somad LC. No.12, Braga, Kec. Sumur Bandung, Kota Bandung, Jawa Barat 40111, Indonesia",-6.9198719,107.6100633,ATJ83ziYfxZiVPDT9Dr7MUT-C5jLSd-XF9bzKpOUYb2FxputgdF6VbDzC4e7t_ZL1wHQEoGSEa8KcI4E2Tg4wYUAYKdNp3eacLrXIGzddtdESMRYN-xcwqXSK8W3w91mzFJa3FDG7bIbVy1nPjaMmB7fS44hQbt2V9sBS1suxdaN4xQvP9L4,ChIJU05Hjy_maC4R8t_TcAfptxI,4.6,3461,kota,KOTA BANDUNG,"3JJ6+32 Braga, Bandung City, West Java",tourist_attraction|point_of_interest|establishment,No,No,Low,Perbelanjaan|Relaxing,Solo|Friends|Couple|Family,00.00,23.59,-,"Taman Braga adalah jalan bersejarah yang memadukan arsitektur kolonial Belanda dengan nuansa modern yang kental. Di sepanjang jalan ini, Anda akan menemukan berbagai toko antik, kafe, dan restoran yang menawarkan makanan lezat.","Taman Braga terletak di pusat kota Bandung, sehingga mudah diakses dengan kendaraan pribadi, taksi, atau ojek online. Jika Anda menginap di sekitar kawasan Bandung, Anda bahkan bisa berjalan kaki ke Taman Braga.",Anda bisa menikmati berjalan-jalan sepanjang jalan. mengeksplorasi toko-toko antik yang menarik.mencicipi kuliner lokal di restoran dan kafe.,toilet umum. tempat parkir. kafe dan restoran.,"Sebaiknya datang selama hari kerja atau pagi hari untuk menghindari keramaian yang biasanya terjadi pada akhir pekan atau sore hari.Pastikan Anda membawa uang tunai, meskipun sebagian besar tempat menerima kartu kredit. Jangan lupa untuk mencicipi makanan dan minuman khas Bandung."
Taman Cibeunying,"3JWF+6M2, Jl. Tm. Cibeunying Sel., Cihapit, Kec. Bandung Wetan, Kota Bandung, Jawa Barat 40114, Indonesia",-6.9044943,107.6241329,ATJ83zjdSBFg5oWcY8pf8gVq2YOEIODJ4Y0NcsvM385jdrueoL3ROXf_ckPNBbowQaWk4BxEsLEHyl5DmLAsYGXQidT3ANxKddkHY7qmkWyVPOkx4wo1dQE1j3LC70QvwW5AQHWGIbXfImtqwMgbbRgZnGCByMr99hYdH4D3yQePde1mkcvI,ChIJZ4oPAbXnaC4ReIbiUW7xtu0,4.5,8019,kota,KOTA BANDUNG,,tourist_attraction|park|point_of_interest|establishment,No,No,Low,Relaxing|Kuliner,Solo|Friends|Family,04.00,23.0,-,"Taman Cibeunying, yang memiliki sejarah panjang, adalah salah satu taman terletak di tengah kota Bandung dan merupakan peninggalan masa kolonial Belanda. Pada era kolonial, taman ini dikenal sebagai Tjibeunjing Plantsoen dan merupakan bagian dari jalur hijau yang menghubungkan Taman Cilaki hingga Taman Bengawan. Pada tahun 1980, taman ini diubah menjadi pusat tanaman hias oleh mantan walikota Bandung, Ateng Wahyudi.","Taman Cibeunying berlokasi di pusat kota Bandung, sehingga mudah diakses dengan berjalan kaki, sepeda, atau transportasi umum. Banyak taksi dan ojek online juga tersedia di sekitar area ini.","Anda bisa membeli dan menikmati pemandangan tanaman hias.Berkumpul bersama teman,keluarga atau komunitas.",Bike Shelter.gazebo.Tempat duduk.,"Datanglah dengan pakaian yang nyaman, terutama jika Anda berniat berjalan-jalan.Jaga kebersihan dengan membuang sampah pada tempatnya."
Taman Film,"4J25+G3H, Jl. Layang Pasupati, Tamansari, Kec. Bandung Wetan, Kota Bandung, Jawa Barat 40116, Indonesia",-6.8986869,107.6077451,ATJ83ziocv8CrYrTjntKQnC47u0i4PUbrRAWnMD19FwGdEV783Z53sjqteW89OUjVt7AMEb-p_qVgQ_hlnWqanjYvC229vapYnuWOpASHxby4afCq6taT_RHAJUQRttG1ekBhzxR1mmp9p9V1AcZBrO_6CcLEo7qKLYZl452ZBIp3cdXy9-7,ChIJqycGPUXmaC4RMexo0NkWNEA,4.3,4226,kota,KOTA BANDUNG,,tourist_attraction|park|point_of_interest|establishment,No,No,Low,Relaxing,Solo|Friends|Couple|Family,00.00,23.59,-,"Taman Film adalah salah satu taman tematik dan ruang terbuka publik di Kota Bandung yang terletak di bawah Jembatan Pasupati, Bandung, Jawa Barat.","Dari Alun-Alun Bandung, menuju Taman Film Bandung di Jalan Layang Pasupati, Bandung Wetan, Anda dapat mengambil Jalan Layang Pasupati. Perjalanan ini hanya membutuhkan waktu sekitar 15 menit dengan kendaraan pribadi. Jika Anda ingin menggunakan transportasi umum, naiklah Trans Bandung dengan rute Leuwipanjang - Dipatiukur atau Abdul Muis - Ledeng, dan turun di Cisitu-Tegalega, lalu lanjutkan perjalanan ke Taman Film Bandung.",Berpiknik.Bersantai sambil membaca buku yang disediakan.Bersantai sambil menonton film.,rumput sintetis.tempat duduk.area film terbuka.area perpustakaan.tempat parkir.Playground.WiFi.,Datang pada hari kerja untuk menghindari kerumunan yang lebih padat.Pastikan untuk mengecek jadwal tayang film jika Anda ingin menonton.
Taman Gesit,"4J38+QJ4, Jl. Dipati Ukur, Lebakgede, Kecamatan Coblong, Kota Bandung, Jawa Barat 40132, Indonesia",-6.8956231,107.6165655,ATJ83zihNXWiMXgMb4zZ2ilN9Z43IeaK5j_gEksFr9k7NFARECiaeFOnwNaK7hvbBiYUwmcdn8-z9jhKxxQUXb3od_WJ1HYtZpzEJwe-UDxvv3rG41Z_UZA_XSU0OiQy9pZIOj305nsRXG3gRmdk6rNGJSJhoSfB_59YE1kIQxyYPI5qTCu5,ChIJxSi4PVLmaC4RxuXfunfrR3o,4.3,563,kota,KOTA BANDUNG,,park|tourist_attraction|point_of_interest|establishment,No,No,Low,Relaxing,Solo|Friends|Family,00.00,23.58,-,"Taman Gesit, yang meliputi area seluas sekitar 556,5 meter persegi, menawarkan konsep Green and Active, menyajikan sebuah ruang hijau tematik di kota Bandung. Taman ini dibangun dengan sengaja untuk menjadi Ruang Terbuka Hijau (RTH), mirip dengan Babakan Siliwangi.Taman ini secara resmi diperkenalkan oleh pemerintah kota Bandung di bawah pimpinan Ridwan Kamil pada tanggal 1 April 2015.","Taman ini memiliki lokasi yang strategis, memudahkan akses baik dengan kendaraan pribadi maupun transportasi umum.Sebagai contoh, jika Anda memilih menggunakan transportasi umum, Anda dapat mengambil Bus Damri dari Terminal Leuwipanjang dengan rute menuju Dipatiukur.Sementara jika Anda membawa kendaraan pribadi, akses ke taman akan lebih mudah. Anda hanya perlu mengandalkan GPS untuk panduan perjalanan.","Jika Anda berlibur dengan anak-anak, mereka akan senang bermain di area bermain yang tersedia.Taman ini sempurna untuk piknik bersama keluarga atau teman-teman. ",Tree Deck. area permainan.patung-patung.rak buku.,Jangan lupa membawa air minum dan makanan ringan.Hargai keindahan alam dan jangan lupa untuk menjaga kebersihan taman dengan membuang sampah pada tempatnya.
Taman Lansia,"3JXC+49W, Cisangkuy St, Citarum, Bandung Wetan, Bandung City, West Java 40115, Indonesia",-6.9021326,107.6209387,ATJ83zhvsLJjmtA8bPAamHUtME8S1CX5f1_FFzP8ncBxvtcZ3T6sKhb7AjItrqpCidPWcRLaHkePq3ZA5JHuK0_eirwZmB3WrC-Yl78RHfgf5iFod44CAwIBNdu1F3v2-Hs8eu23nXP-xwDUuHQ6VXUaGNPVdvfSPPlqFmtJ2by5edVSxxJf,ChIJoQd1OLDnaC4RcsJIJXr8ytY,4.5,10923,kota,KOTA BANDUNG,,tourist_attraction|park|point_of_interest|establishment,No,No,Low,Relaxing,Solo|Friends|Couple|Family,00.00,23.59,-,"Taman Lansia Bandung adalah taman yang dirancang khusus untuk para lansia dan juga tersedia bagi masyarakat umum. Taman ini menawarkan suasana tenang dan hijau dengan beragam tanaman yang indah, area duduk yang nyaman, dan jalur berjalan.","Taman Lansia memiliki lokasi yang sangat strategis, terletak dekat dengan pusat Kota Bandung. Tepatnya, alamatnya adalah Jalan Cisangkuy, Citarum, Bandung Wetan, Bandung, Jawa Barat. Bahkan, taman ini hanya berjarak 2 kilometer dari pusat Bandung, sehingga Anda dapat mencapainya dalam waktu singkat, sekitar 5 menit saja.","Anda dapat menjelajahi taman ini dengan berjalan kaki, menikmati keindahan alam, dan melakukan piknik di area yang disediakan. Taman Lansia sering menjadi tempat bagi para lansia yang melakukan senam pagi. Anda dapat bergabung dalam kegiatan ini dan merasakan suasana lokal.Dengan lanskap hijau dan bunga-bunga yang bermekaran, taman ini adalah tempat yang bagus untuk fotografi.",playground.Tempat duduk.Tempat parkir.,Pastikan untuk membawa air minum dan perlengkapan piknik jika Anda berencana untuk berlama-lama.Jaga kebersihan dan kerapihan taman selama berkunjung.
