name,formattedAddress,lat,long,photoReference,placeID,rating,userRatingsTotal,cityType,cityName,compoundCode,types,hiddenGems,ticketStatus,budget,category,userType,openHours,closeHours,closeDays,description,access,activity,facility,suggestion
Indonesian Museum of Ethnobotany,"Pusat Penelitian Biologi â€“ LIPI, Jl. Ir. H. Juanda No.22 - 24, RT.02/RW.08, Paledang, Kecamatan Bogor Tengah, Kota Bogor, Jawa Barat 16122, Indonesia",-6.599120699999999,106.7939635,ATJ83ziLC-LQF2O03AlA0XHmeZPmwK9aiLt0pN9HYw5t4bNbiRjTlSNu5p554GZedTwjgXxcJA82JUHo0OCrjfU1shmxLCdCqvuK_8kdg5Yf5AqDKP_T6zU-6UXOvE7mDK6D1-6rA_xYVe24Jo9U2J0MQGyXse3oBCVyv5HebQOHb-oSHFRz,ChIJ-_H97MfFaS4RkMHGqwswIT0,4.6,1247,kota,KOTA BOGOR,"CQ2V+9H Paledang, Bogor City, West Java",museum|tourist_attraction|point_of_interest|establishment,No,Yes,Low,Edukasi|Historical|Entertain,Solo|Family|Couple|Friends,08.00,16.0,-,"Museum Etnobotani Bogor adalah museum yang menggabungkan ilmu botani dengan karya budaya etnik dari seluruh Indonesia. Dibangun pada tahun 1982, museum ini memamerkan artefak sekitar 2000 dari berbagai daerah di Indonesia, termasuk peralatan rumah tangga, mainan, pakaian tradisional, alat pertanian, alat musik, dan koleksi tumbuhan obat.","Terletak di Jl. Juanda No 22-24, Bogor, Jawa Barat, museum ini dekat dengan Istana dan Kebun Raya Bogor, dapat dijangkau dengan berjalan kaki.","Pengunjung dapat melihat relief, artefak rumah tangga, peralatan pertanian, alat musik, dan kain tenun tradisional.Diorama dan artefak memperlihatkan bagaimana suku di Indonesia memanfaatkan tumbuhan.Mempelajari tumbuhan obat.",Diorama dan informasi budaya.,Cek jam operasional karena museum ini memiliki jadwal operasional yang berbeda.Baca informasi yang tertera di dekat kaca untuk memahami artefak yang dipamerkan.
Kampoeng Wisata Cinangneng,"CPM6+JHG, Jl. Babakan Kemang, RT.1/RW.2, Cihideung Udik, Kec. Ciampea, Kabupaten Bogor, Jawa Barat 16620, Indonesia",-6.5659313,106.7114553,ATJ83zjS6pXwAvU8NjF9KG2RsQsDIqlAj-HRSpHP19SlSdshdW-KNYga0l1JxYeawg8K78ArXqfe4R4sicNNEWUZU8r0y1PFQsnQhGVxROj_QPy4JaAUs8Plst3C3WhoMR-P6MUej4eUgSB4PxPhgxn9_RLjM6sb8Lc1NP3e4pFef3AxjgXH,ChIJSU0oJkbbaS4Rh1AyD5vUkEQ,4.4,1956,kota,KOTA BOGOR,,tourist_attraction|point_of_interest|establishment,No,Yes,Medium,Nature|Relaxing|Entertain|Perbelanjaan|Kuliner|Edukasi|Art,Solo|Family|Couple|Friends,08.00,17.0,-,"Kampoeng Wisata Cinangneng adalah destinasi wisata di Bogor dengan konsep edukasi dan nilai budaya. Tempat ini menawarkan suasana pedesaan yang sejuk dan menyegarkan, cocok untuk menghindari keramaian perkotaan.","Terletak di Jalan Babakan Kemang, Cihideung Udik, Kecamatan Ciampea, Kabupaten Bogor. Lokasinya dapat diakses melalui rute jalan utama, dan kendaraan pribadi maupun transportasi umum.","Mengunjungi usaha-usaha kecil warga setempat seperti konveksi dan kerajinan bambu.Bermain alat musik tradisional, menari tarian tradisional, membuat kue, mempelajari pembuatan jamu, melukis di caping, membuat wayang-wayangan, dan memandikan kerbau.",perlengkapan pakaian adat.,Sesuaikan paket wisata dengan jumlah peserta dan aktivitas yang diinginkan.Jangan ragu untuk bertanya kepada instruktur tentang aktivitas atau hal lain yang ingin dipelajari.
Leuwi Hejo,"Jalan raya, Cibadak, Kec. Sukamakmur, Kabupaten Bogor, Jawa Barat 16830, Indonesia",-6.5926623,106.9549826,ATJ83zgTgaF98htTkP42wSP169fGVs7vM80HlxKFe0ZF9ZF6hA-MQTQqIdClILh-mB1148puL_lXR5sANM44BivzbMhpjuUsfoxpY67X-Xd_kfhBbIMahtNl2PK-OfDtDwOGQ5fgUAUhqTKsTrXLix_eZijiSjS6jjG0yJZeJ3APPl59Tg7w,ChIJKQHQj1O4aS4RLKzwNHhUi_o,4.3,9724,kota,KOTA BOGOR,"CX43+WX Central Karang, Bogor Regency, West Java",tourist_attraction|point_of_interest|establishment,No,Yes,Low,Nature|Relaxing|Adventure,Solo|Family|Couple|Friends,00.00,23.59,-,"Air terjun Leuwi Hejo, terletak di Sentul, Bogor, adalah air terjun yang dikenal dengan warna airnya yang hijau. Keindahannya meliputi panorama perbukitan hijau dan kejernihan airnya, membuatnya menarik bagi pengunjung yang ingin menikmati keindahan alam.","Lokasi air terjun ini berada di Kawasan Hutan RPH Babakan Madang BKPH Bogor. Untuk mencapainya, wisatawan harus melakukan perjalanan trekking sekitar 20-30 menit dari lokasi parkir. Rutenya melalui jalur trekking yang landai dan tangga bebatuan, dan terdapat jembatan bambu menuju air terjun.",Bermain air.Menikmati pemandangan.Hiking dan trekking.,Pos keamanan.Sewa alat pelampung.Toilet.kedai makanan dan minuman.,Pastikan untuk memperhatikan cuaca dan membawa barang secukupnya untuk kenyamanan selama trekking.Kenakan pakaian dan sepatu yang nyaman untuk hiking.
Kampung Perca Sindangsari,"Gg. Raden Alibasyah, Sindangsari, Kec. Bogor Tim., Kota Bogor, Jawa Barat 16146, Indonesia",-6.6528624,106.8458244,ATJ83zjzMrLw_N4IPOMILQsZdlbinFUrFesI1_U9CDU76NuCPavQkZt73DfSTmMkhBLoe1kY-1qFZu3gb6ohQwAlTJKUJd3FJc7-9ZJ6B5PmtZSRl_bzyD_vm3V_EJWhqTeIMUS8bh6laPz3_CVGkMROfaIJ-A192b6tbb-6KaC_drf2XX-n,ChIJMZ2iPk3JaS4RixH8tBHFWaw,4.7,58,kota,KOTA BOGOR,"8RWW+V8 Sindangsari, Bogor City, West Java",tourist_attraction|point_of_interest|establishment,No,No,Low,Relaxing|Entertain|Perbelanjaan|Kuliner|Edukasi|Art,Solo|Family|Couple|Friends,09.00,16.0,-,"Kampung Perca di Gang Raden Alibasyah, Jalan Raya Wangun Atas, Sindangsari, Bogor Timur, merupakan sebuah kampung wisata yang menerapkan konsep pemberdayaan perempuan dan ibu rumah tangga. Kampung ini berdiri sebagai inisiatif dalam menghadapi menurunnya perekonomian akibat pandemi COVID-19 dengan mengembangkan potensi kain sisa atau kain perca.","Kampung Perca berlokasi di Gang Raden Alibasyah, Sindangsari, Bogor Timur, dapat dijangkau melalui Jalan Raya Wangun Atas. Lokasinya berada di kelurahan padat penduduk di Kota Bogor, Jawa Barat.","Mengunjungi galeri-galeri seperti Galeri Kriwil, Galeri Petok, Galeri Pangsi, dan Galeri Pak Has untuk melihat dan membeli produk-produk kerajinan dari kain perca.Menikmati kuliner khas yang tersedia di tempat, serta melihat proses pembuatan produk kerajinan.Mural dan spot foto menarik di sekitar kampung untuk berfoto dan mengabadikan momen.",Kamar mandi umum.Kios souvenir.Spot foto.,Kenakan pakaian yang nyaman dan sesuai untuk berjalan-jalan di kampung.Mungkin lebih baik membawa uang tunai karena tidak semua tempat menerima pembayaran dengan kartu.Belilah produk lokal sebagai dukungan terhadap pemberdayaan masyarakat setempat.
Pusat Pengembangan Teknologi Penangkaran Rusa Bogor,"Jl. Pinus No.12, RT.03/RW.05, Situgede, Kec. Bogor Bar., Kota Bogor, Jawa Barat 16115, Indonesia",-6.550680499999999,106.7470717,ATJ83zgmHrzXm8sFkfOt310BY7xmx0fH0kL4iLqapFmLgsUfQ9Ad4D61yicn7oE_JniTm7sbwd7uE5_Ovl9lCoAfxzZ6KEGr8uUcadLnMWKTUUVuixhCuyJR1eQ2v1TKmM7HTbISuUa51REEWLFzX0zrBsnel6rnTjvwAYopvq5XdsivBQYg,ChIJZat_ep_EaS4Ry8ibNsPWjeE,4.5,213,kota,KOTA BOGOR,"CPXW+PR Situgede, Bogor City, West Java",tourist_attraction|zoo|point_of_interest|establishment,No,No,Low,Nature|Relaxing|Entertain,Solo|Family|Couple|Friends,08.00,17.0,-,"Pusat Pengembangan Teknologi Penangkaran Rusa Bogor adalah lokasi penangkaran rusa yang juga menjadi tempat rekreasi dengan suasana alam yang teduh. Terletak di Jl. Pinus No.12, Situgede, Bogor Barat, Jawa Barat, pusat ini menawarkan pengalaman berinteraksi dengan rusa sambil menikmati keindahan danau Situ Gede.","Lokasinya berada di Jl. Pinus No.12, Situgede, Bogor Barat, dapat diakses melalui CIFOR Bogor. Untuk masuk ke area gunung, tidak dikenakan biaya.",Berinteraksi dan memberi makan rusa yang ada di penangkaran.Menikmati danau yang luas dengan kesempatan menyewa perahu bebek untuk mengelilingi danau.Menikmati suasana hutan pepohonan rimbun dengan udara sejuk.,Kandang rusa.Fasilitas parkir.Area bersantai.,"Mohon untuk tidak meninggalkan sampah sembarangan.Berinteraksi dengan rusa dengan tetap memperhatikan aturan dan keselamatan hewan.Pusat ini bisa cukup ramai pada akhir pekan, terutama hari Sabtu dan Minggu."
Goa Agung Garunggang,"Jl. Ptp Terusan, Karang Tengah, Kec. Babakan Madang, Kabupaten Bogor, Jawa Barat 16810, Indonesia",-6.57315,106.936201,ATJ83zgLOQfYNsKOZlIYDt_blnIE9eJdY3owfJtNhzhe8Me8Jmm3as1RGSgpZ-8DmwsfFHk5bPIKI30an-qkKECPCkWEicNr38lw90PamgVvMfAk68JM4xGkWxyXxymM1UPuqngMODtY5CP_dcSgWQd4zD7NV9y6Ax2HRhfAQ1f3H4JYAu_8,ChIJj8kjtPK4aS4RBjTeIL8Itts,4.6,635,kota,KOTA BOGOR,"CWGP+PF Central Karang, Bogor Regency, West Java",tourist_attraction|park|point_of_interest|establishment,No,No,Low,Nature|Relaxing|Adventure,Solo|Family|Couple|Friends,08.00,16.0,-,"Goa Agung Garunggang di Bogor adalah gua unik yang memerlukan penurunan ke bawah untuk dijangkau. Terletak di bawah tanah, di dalam gua ini terdapat stalaktit, stalagmit, dan air terjun mini. Di sekitar gua, terdapat labirin batu alami dan sungai dengan air yang sangat jernih.","Lokasi gua ini berada di Jalan Ptp Terusan, Karang Tengah, Kecamatan Babakan Madang, Kabupaten Bogor. Dapat diakses dengan berkendara sekitar 22 kilometer dari pusat kota Bogor, memakan waktu sekitar 1 jam.",Menjelajahi gua.Eksplorasi labirin batu.Bermain di sungai.,Tangga bambu.Warung.Pemandu.,"Siapkan fisik yang baik karena akan ada perjalanan sekitar tiga kilometer, termasuk perjalanan di dalam gua.Bawa senter atau headlamp sendiri karena gua sangat gelap.Gunakan alas kaki yang nyaman dan perhatikan kebersihan.Di dalam gua terdapat kelelawar, jadi tetaplah menghormati habitat mereka.Meskipun tidak ada biaya masuk, disarankan memberikan sumbangan sukarela kepada pemandu."
Gunung Peyek,"HPC2+22X, Jl. Pasar Ciseeng, Bojong Indah, Kec. Parung, Kabupaten Bogor, Jawa Barat 16330, Indonesia",-6.4298752,106.7000962,ATJ83zixlOayBsQLka0jBn81zlBscaPWZI9a32GwHB_rByTBRzXDEfqLctsHa1iBqT-dxh3wFL14vMmbLzwbmrJObggN7ZbbIsGvOG38IEXK6RdnjWYNKnhND58-eQB-Bk3QowPVKHe6NW7AjkcCo0VLaqb5nrodX8XJNxvjs-aeHwY8n0-h,ChIJYQDldMrnaS4RfJlMNheX-cs,4.0,940,kota,KOTA BOGOR,,tourist_attraction|point_of_interest|establishment,No,Yes,Low,Nature|Relaxing|Adventure,Solo|Family|Couple|Friends,07.00,17.0,-,"Gunung Peyek adalah destinasi wisata alam di Bogor yang terletak di tengah area persawahan. Meskipun disebut gunung, sebenarnya ini adalah bukit kapur kecil yang memiliki pesona pemandian air panas yang memukau.","Lokasinya berada di Jalan Pasar Ciseeng, Bogor, terletak di tengah-tengah sawah. Akses ke sini lebih cocok dengan motor atau sepeda karena aksesnya yang kecil. Pada musim hujan, jalannya licin dan berlumpur, perlu perhatian khusus saat melintasinya. Bagi pengunjung yang membawa mobil, dapat memarkir di kawasan perumahan warga dan berjalan kaki ke lokasi.",Pemandian air panas.Bersepeda.Spot foto dan pemandangan alam.,Toilet.Warung makan.Tempat parkir.Spot Foto.Pemandian air panas.,"Untuk merasakan ketenangan alam, sebaiknya hindari hari libur karena tempat ini cenderung ramai.Meski berbau belerang, airnya hangat dan menyenangkan untuk berendam.Perhatikan keadaan jalanan, terutama saat musim hujan yang membuat akses licin.Tetap hormati keyakinan sekitar yang menganggap Gunung Peyek sebagai tempat yang sakral."
Panorama Travel Pabangbon,"9HJV+GG4, Jl. Raya Leuwiliang - Bogor, Leuweung Kolot, Kec. Cibungbulang, Kabupaten Bogor, Jawa Barat 16630, Indonesia",-6.6187472,106.593819,ATJ83zjWeTf58oZWkXQGzBMnaHjG0jgyFnKIZfUD2SkH2pl9bVsZXrGQTDOsvyw8F2WJpayyVN1rX78HW1LPzKah9em--2eOwo3AI4uZfUMdrFMe3ODDtjn_NriuCgEL3t2aJlJzp7TRZHJKP9Jj7VIHUEfZ09ads60VELtxSUhL7p-EhNOz,ChIJf7z3F3bbaS4RZAAR-1fOdVE,4.0,1034,kota,KOTA BOGOR,,tourist_attraction|point_of_interest|establishment,No,Yes,Low,Nature|Relaxing|Entertain,Solo|Family|Couple|Friends,07.00,17.0,-,"Panorama Travel Pabangbon di Leuwiliang, Kabupaten Bogor, Jawa Barat, adalah objek wisata rumah pohon yang menawarkan pemandangan hutan pinus yang sejuk. Pengunjung dapat menikmati spot selfie menarik dan bersantai di hammock yang digantung di pohon pinus.","Dari Kota Bogor, Anda dapat menggunakan jalur Leuwiliang menuju Panorama Pabangbon. Jalur ini direkomendasikan karena lebih cepat dibandingkan Jalan Raya Dramaga yang sering macet. Jika dari Jakarta atau Depok, jalur Parung-Atang Sanjaya menuju Leuwiliang juga dapat dipilih.",Menikmati pemandangan.Relaksasi.Spot foto.,Hammock.Gardu Pandang.Rumah Pohon.,Hindari keramaian dengan datang pada hari kerja.Pastikan membawa kamera dan peralatan lainnya untuk mengabadikan momen liburan.
Sempur Park,"dekat Lapangan Basket Lapangan, RT.01/RW.01, Sempur, Kecamatan Bogor Tengah, Kota Bogor, Jawa Barat 18529, Indonesia",-6.5917106,106.8008294,ATJ83zhO5o8l8vZEYMk0GbBs7_p-WPi2uG1n1hVngmU6y1pS9v1FIMwZxgHUib8DC1Phh5On6E37AZWd3eeyy42wfbUZkP-JeSpvM9E7Yhyb2paz3uzjCQMOsEaqyIw3Q9z9Nq8hCJ8CDevEao4jqgwWziY1jckLK1jT2N1GM6gJQj-BrlEW,ChIJUXi1GszFaS4R_Dy17VQAOpI,4.6,16581,kota,KOTA BOGOR,"CR52+88 Sempur, Bogor City, West Java",park|point_of_interest|establishment,No,No,Low,Relaxing|Entertain,Solo|Family|Couple|Friends,00.00,23.59,-,"Taman Sempur di Bogor adalah ruang terbuka hijau seluas 3 hektar di bantaran Sungai Ciliwung, terletak dekat Kebun Raya Bogor. Sejak 2010, taman ini terus diperbaiki dan kini menawarkan rekreasi, fasilitas olahraga, dan acara komunitas.","Taman ini terletak di Jalan Sempur Kidul, Bogor, dekat Kebun Raya Bogor dan Taman Kencana. Akses via Jalan Padjajaran membutuhkan waktu sekitar 9 menit. City tour di Bogor dapat dimudahkan dengan penyewaan Hiace Luxury Bogor di Salsa Wisata.",Berolahraga.Berrekreasi.,Parkir.Mushola.Fasilitas olahraga.,"Buka 24 jam, fasilitas umum aktif sekitar jam 07.00-22.00 WIB.Tiket masuk gratis, namun ada biaya untuk fasilitas tertentu dan parkir kendaraan."
Tirta Sanita Hot Spring,"HM9W+H6M, Jl. Raya Ciseeng, Bojong Indah, Kec. Parung, Kabupaten Bogor, Jawa Barat 16330, Indonesia",-6.4310449,106.6955609,ATJ83zgr5ow5mofFlLzClLElMj8_dBoQZc3wJPDzRBndUtiMRFkBXO7r_O5jOxGfjaDcvi7iaXv96BmmjorEkVIeFLAElBY5ClJ5sbOLshakanMj36A8nnRgGbaafDEHaUs8d9gtmLA2PWet3-wcpjj53k490pJBtATIn--5ggJHrdYl8AJY,ChIJq6qqqtbnaS4R7x-owxJpPLI,3.7,4554,kota,KOTA BOGOR,,tourist_attraction|point_of_interest|establishment,No,Yes,Low,Nature|Relaxing|Entertain|Adventure,Solo|Family|Couple|Friends,07.00,17.0,-,"Tirta Sanita Hot Spring, juga dikenal sebagai Tirta Sayaga, adalah pemandian air panas yang terletak di Ciseeng, Bogor. Tempat ini didirikan pada tahun 1990 dan diresmikan pada tahun 1992. Sumber air panas di sini mengandung senyawa belerang, dan oleh masyarakat setempat, diyakini memiliki kemampuan penyembuhan berbagai penyakit.","Tirta Sanita Ciseeng dapat dicapai dengan beberapa rute yang berbeda. Dari Depok, perjalanan sekitar 15 km atau sekitar 30 menit, melalui Jl. Raya Sawangan, Jl. Muchtar Raya, dan Jl. Jakarta-Bogor ke arah selatan, lalu belok kanan di pertigaan Parung dan cari petunjuk menuju Tirta Sanita. Dari Bogor, jarak sekitar 25 km, dengan mengikuti Jl. Jakarta-Bogor hingga mencapai pertigaan Jl. Mad Nur, lalu belok kiri di perempatan Ciseeng. Dari Jakarta, rute terdekat adalah melalui Pondok Indah, Serpong, Taman Tekno, dan menuju Puspitek, sekitar 10 kilometer lagi sampai di Tirta Sanita Ciseeng.",Nikmati perendaman di kolam-kolam air panas.Mencoba berbagai wahana outbound..Mencoba berbagai wahana permainan.,Kolam renang.Warung makanan.Mushola.Area parkir.Toilet.Playground anak.Penginapan.,"Pastikan Anda membawa pakaian renang, perlindungan matahari, dan perlengkapan mandi.Ajak keluarga atau teman-teman Anda untuk bersenang-senang di kolam rendam atau mencoba wahana permainan outbound.Nikmati suasana alam yang indah dan manfaatkan fasilitas yang tersedia untuk pengalaman yang lebih baik. Pastikan Anda merencanakan waktu yang cukup untuk menikmati semua aktivitas yang ditawarkan."
Curug Tiis,"CRX3+FJG, RT.07/RW.15, Kedunghalang, Bogor Utara, Bogor City, West Java 16165, Indonesia",-6.551304699999999,106.8040847,ATJ83zjtvSM169qG4PDWOKQf1Pw5XP57H9xknbF_rCZfogVRxDdZVu8Zgfrip1v28OBjgUX8ON39V2k4hFqqweiHtYNea3Wcvm_tkOrxlY5t4IJ11BbbCg7LN7mOWQ7xo4fG6r4okh4LV8VvLLcrL2AR8NnQS1dHlPyUk3vwOKeH1iRn-tnP,ChIJ95ObcbfFaS4R98DjOzk7YWE,4.5,6,kota,KOTA BOGOR,,tourist_attraction|point_of_interest|establishment,No,Yes,Low,Nature|Relaxing|Entertain,Solo|Family|Couple|Friends,07.00,20.0,-,"Curug Citiis adalah destinasi pemandian air panas yang terletak di kaki Gunung Galunggung, Tasikmalaya. Terkenal sebagai tempat relaksasi dengan kolam alami di tengah alam yang indah.","Lokasi Curug Citiis berada di Kampung Citiis, Desa Padakembang, Kec. Padakembang, Kab. Tasikmalaya, Jawa Barat. Aksesnya dapat dilakukan dengan kendaraan roda dua atau roda empat melalui Jl. Ciawi-Singaparna menuju Singaparna dan arah Gunung Galunggung.",Berendam di kolam air panas.Menikmati alam sekitar.,Parkir.Kolam air panas.,"Akses jalan bisa sulit, persiapkan diri untuk menyusuri jalur setapak yang rindang.Buka 24 jam, namun jam operasional fasilitas tertentu berkisar antara 07.00-20.00 WIB.Tiket masuk terjangkau sekitar Rp. 5.000,- dan biaya parkir kendaraan."
Saung Kreatif Mulyaharja,"Jl. Pabuaran Tengah, RT.03/RW.10, Mulyaharja, Kec. Bogor Sel., Kota Bogor, Jawa Barat 16135, Indonesia",-6.650764,106.7910145,ATJ83zj9iuGAlYx43DE_gLiWebkwQUtKW5icjArev29MJsUKtIPySF8tVm_Hh273dAB0wG2maM2KOq6gPOh0dG73XeyNvrCcKDN5NqXmGT7yrtpGaM-o-cobFE7At5E_fSASzcNADKKB6xwFykEECzjsWCSan_HLcWIWsDeTVetemG7be8Id,ChIJzxAhcjHPaS4RrESQSLrT2lk,4.8,4,kota,KOTA BOGOR,"8QXR+MC Mulyaharja, Bogor City, West Java",tourist_attraction|point_of_interest|establishment,No,Yes,Low,Nature|Relaxing|Entertain|Adventure,Solo|Family|Couple|Friends,07.00,20.0,-,"Saung Kreatif Mulyaharja adalah destinasi wisata di Bogor yang menawarkan suasana pedesaan yang indah dengan hamparan pesawahan, saung, dan aktivitas kebun. Destinasi ini terletak di kawasan Mulyaharja, Bogor, dengan pemandangan pesawahan yang menyejukkan.","Perjalanan menuju Saung Kreatif Mulyaharja bisa dimulai dari area Kalimalang, Pondok Gede, dan berlanjut hingga ke Tikum Cibubur. Rute kemudian melalui jalan raya Bogor, melewati gang-gang pemukiman dan jalanan menanjak menuju area Bogor Nirwana Residence.",Bersepeda.Menikmati alam.,Tempat istirahat.Area parkir.,Bawa perlengkapan untuk cuaca panas atau hujan.Saran untuk penambahan tempat duduk atau saung di area yang rindang untuk kenyamanan pengunjung.Bawa bekal makanan dan minuman sendiri karena ketersediaan fasilitas makanan mungkin terbatas.
"Curug Ciburial, Jonggol","Jl. Gunung Wangun Kampung Cibereum, Cibadak, Kec. Sukamakmur, Kabupaten Bogor, Jawa Barat, Indonesia",-6.6018158,106.9592445,ATJ83zhLUs_fTllt25h4sWu8E-P-AenMcaE_7LHBF3oEe6tL4zSEpdABQAF2rsPBZEQy-L6mQKFBwCviO-wpgngymOC9LGmS3UF9KbiS3fXrqWKW6sVock0EACj9HaPni5cb82ZoCZLcF0Kl6aaSq9-szKHwIET--IH3i1OTgEYi_L-ck0r9,ChIJJS5sqkq4aS4R7hd1mn6XCm0,4.5,294,kota,KOTA BOGOR,"9XX5+7M Cibadak, Bogor Regency, West Java",tourist_attraction|point_of_interest|establishment,No,Yes,Low,Nature|Relaxing|Adventure,Solo|Family|Couple|Friends,06.00,18.0,-,"Curug Ciburial adalah air terjun yang menawarkan kesegaran alam dan ketenangan di tengah kesibukan kota. Meski memiliki ketinggian yang tidak terlalu tinggi, keindahan alam sekitarnya membuatnya menarik untuk dikunjungi.","Terletak di Desa Karang Tengah, Kecamatan Babakan Madang, Kabupaten Bogor, Jawa Barat, Curug Ciburial dapat dicapai dari Jakarta dalam waktu sekitar 2 jam (jarak sekitar 60 km) dan dari pusat Kota Bogor dalam waktu sekitar 1 jam (jarak sekitar 32 km).",Bermain air.Berjalan dan trekking.Berpiknik.,Toilet dan Kamar ganti.Warung makanan.Tempat parkir.,"Pakailah alas kaki yang nyaman, terutama jika berkunjung saat medan yang becek.Bawa handuk dan baju ganti jika berencana untuk bermain air.Selalu bawa kantong sampah dan jaga kebersihan lokasi.Siapkan bekal makanan atau beli di warung yang tersedia."
Taman Safari Indonesia Bogor,"Jalan Kapten Harun Kabir No.724, Cibeureum, Kec. Cisarua, Kabupaten Bogor, Jawa Barat 16750, Indonesia",-6.7206492,106.9508355,ATJ83ziyZlQL1rawSSxOomsCsY5BA3H3Y-yoJpf3uWgfK0kgUFJnrvXqecCWzV3oSiUVGkSpABLbvlmD24W2V1wEcJg5b5Jnr38VS_yuzylVNzH8DLEbYlmfqSG2QoSYpTm254aMq7uZA4ZKAl3pfPPKtGLoiEHElFDUmYXitC6vAsgzNQQe,ChIJg-7mFM-1aS4R2RGPC7JrWAY,4.7,58847,kota,KOTA BOGOR,"7XH2+P8 Cibeureum, Bogor Regency, West Java",zoo|tourist_attraction|park|point_of_interest|establishment,No,Yes,Medium,Nature|Relaxing|Edukasi|Entertain|Perbelanjaan|Kuliner|Adventure,Solo|Family|Couple|Friends,09.00,17.0,-,Taman Safari Bogor merupakan salah satu kebun binatang terbesar di Indonesia dengan lebih dari 280 spesies satwa dan hamparan lebih dari 5000 pohon. Tempat ini tidak hanya menjadi pelestarian satwa langka tetapi juga menawarkan pengalaman safari yang mendidik bagi keluarga.,"Taman Safari Cisarua Bogor dapat dijangkau dari Jakarta sekitar 2-3 jam perjalanan melalui bus jurusan Bandung-Puncak, kemudian ganti dengan angkot arah TSI sekitar 10 menit. Dari Stasiun Bogor, naik angkot hijau 02 menuju Sukasari, ganti angkot biru 03 menuju Cisarua. Dapat juga dijangkau dari Bandung dengan KRL jurusan Stasiun Bogor dan angkot menuju lokasi.",Safari journey.Pertunjukan satwa.Bermain di wahana.,Toilet.Musala.Transportasi Internal Gratis.Restoran dan Cafe.Souvenir outlet.,"Kenakan pakaian nyaman, siapkan alas kaki yang sesuai dengan medan, dan jaga kondisi fisik untuk beraktivitas.Agar dapat menikmati seluruh wahana, datanglah lebih awal di pagi hari.Saat berkeliling, jangan membuka kaca mobil atau keluar demi keselamatan."
Sawargiloka Waterland,"Legok Akub, RT.5/RW.1, Sukaluyu, Kec. Tamansari, Kabupaten Bogor, Jawa Barat 16610, Indonesia",-6.6206581,106.7415364,ATJ83zgWIwpa_UO0UhWUeH2R_WMNPSit4TN0P0wc9SbY0Pek5YXA0Hio-WQDyy50w2GBYuXfThCLuSCbVpdWyGrA45naQp_CBvhy1eTYQARxYw3-CuYh5Abhg_dME3vcjR3naLlfdh-1pfOf_zoXDvxM88dTtCwLkdYd0oizOb2j-csZu1Bk,ChIJPbYjmVzFaS4RreKtKoonHuc,4.4,694,kota,KOTA BOGOR,"9PHR+PJ Sukaluyu, Bogor Regency, West Java",tourist_attraction|point_of_interest|establishment,No,Yes,Low,Nature|Relaxing|Entertain|Kuliner|Adventure,Solo|Family|Couple|Friends,08.00,17.0,-,"Sawargiloka Waterland adalah pemandian yang terletak di Sukajaya, Tamansari, Bogor, Jawa Barat. Dikelilingi oleh bukit-bukit dan hutan kecil, tempat ini menawarkan suasana asri dengan udara sejuk terutama di pagi hari.",Dapat diakses melalui Jalan. Ir. H. Juanda dari arah Kebun Raya Bogor. Pengunjung hanya perlu mengikuti Jalan. Ciapus Kompas dan terus lurus hingga menemukan destinasi tersebut di sebelah kiri jalan.,Berenang.Berkemah.,Area piknik.kolam pengobatan Ikan.gazebo.Area bermain anak.Kamar ganti.Penyewaan alat camping.,"Kenakan pakaian yang nyaman, siapkan perlengkapan berenang, serta perlengkapan camping jika berniat berkemah.Tiket masuk untuk renang dan piknik sekitar Rp15.000 per orang, belum termasuk kolam terapi ikan sebesar Rp5.000 per orang. Harga tiket dapat berubah sesuai kebijakan pengelola."
Tepas Salapan Lawang Dasakreta,"9RX3+HX4, RT.04/RW.02, Paledang, Bogor Tengah, Bogor City, West Java 16122, Indonesia",-6.6011123,106.804943,ATJ83ziEyZWHouUAKecq_25kqEs6c9h0wlpsnnnHEcNS_1Arusb6YaoGVBBU0hZTzF4F-dmOgOasooUbQfY8sSlk7glkysj999UKA-Uu9HaC--_RtXLx6y1n6486M6UCbs4X1ovyZlJ563PxUZE8KtpFd14pMHPEvC1rRAcN_cDTU_J4RFcD,ChIJRYWXKgLFaS4RXhF2-G9qbEw,4.7,15,kota,KOTA BOGOR,,tourist_attraction|point_of_interest|establishment,No,No,Low,Entertain|Edukasi|Historical,Solo|Family|Couple|Friends,00.00,23.59,-,"Tepas Salapan Lawang Dasakreta, sebuah ikon kota Bogor, terletak di sebelah Tugu Kujang di pusat kota. Diresmikan pada tahun 2016, bangunan ini memperkuat eksistensi Kota Bogor dan dibangun sebagai dukungan dari pemerintah pusat untuk mengangkat status kota ini sebagai kota pusaka.","Tepas Salapan Lawang Dasakreta dapat dijangkau di daerah Baranangsiang, dekat Tugu Kujang dan Kebun Raya. Terletak strategis dekat dengan jalan tol Jagorawi, membuatnya menjadi simbol pintu masuk ke Kota Bogor.",Bersantai dan berinteraksi.,Ruangan terbuka.Tempat duduk.,"Pengunjung disarankan untuk menjaga kebersihan dan kesejahteraan jasmani serta rohani, sejalan dengan konsep Dasakreta. Menjelajahi Tepas Salapan Lawang Dasakreta akan memberikan pemahaman yang lebih dalam tentang sejarah dan filosofi Kota Bogor."
Air Terjun Curug Kawung,"Sukajadi, Tamansari, Bogor Regency, West Java 16370, Indonesia",-6.6747426,106.7273387,ATJ83zhe2VSHaBBqd7HzvAFaS_HyyTllIqt_8XCMhDylxY4kZ5ywJsbM9BjoAfbuU69xSI2INv1R3HXziJgTVDii5jRmsf1m8jI6kUvpUdmVTcr7_f_N8LjEdodIoMyIKVYturkCWsoHz794bp9goVSdfVEUujBADrmmoxiN4SogtlTk576E,ChIJaeyJpivOaS4RPshLUdJ7jWs,4.5,724,kota,KOTA BOGOR,"8PGG+4W Sukajadi, Bogor Regency, West Java",tourist_attraction|point_of_interest|establishment,No,Yes,Low,Nature|Relaxing|Entertain|Adventure,Solo|Couple|Friends,09.00,17.0,-,"Curug Kawung adalah tujuan wisata alam yang menakjubkan di Desa Waring Los, Kecamatan Taman Sari, Kabupaten Bogor, Jawa Barat. Untuk mencapainya dari Kota Bogor, arahkan ke Kabupaten Bogor, kemudian ke Kampung Baru Citayam. Dari sana, temukan petunjuk ke Curug Kawung di Kecamatan Taman Sari. Persiapkan perlengkapan yang tepat seperti sandal, sepatu, jaket tebal, dan cemilan karena jarak dari warung ke air terjun cukup jauh.","Dari Kota Bogor, arahkan ke Kabupaten Bogor, lalu ke Kampung Baru Citayam dan masuk ke Kecamatan Taman Sari. Petunjuk menuju Curug Kawung akan terlihat. Pendakian ke Curug Kawung memerlukan persiapan dan perhatian khusus karena jalur cukup licin dan berlumut.",Menikmati suasana alam.Menikmati keberadaan primata.Bersantai di air terjun.,-,"Disarankan untuk datang pada pagi hari untuk menikmati keindahan alam secara maksimal. Pastikan untuk membawa perlengkapan yang diperlukan seperti sandal, sepatu, dan jaket tebal karena trekking memerlukan perhatian ekstra."
