name,formattedAddress,lat,long,photoReference,placeID,rating,userRatingsTotal,cityType,cityName,compoundCode,types,hiddenGems,ticketStatus,budget,category,userType,openHours,closeHours,closeDays,description,access,activity,facility,suggestion
Kampung Wisata Warungboto,"Balai, Jl. Umbul Raya, RT.38/RW.09, Warungboto, Kec. Umbulharjo, Kota Yogyakarta, Daerah Istimewa Yogyakarta 55164, Indonesia",-7.8133932,110.392982,ATJ83zgLqM6Z48b7Q1VU6gbho2Tbe-d__ACyEMqB2ryOiBWTb8QyT_P4FXevYQvxjUwcs1v6uJQSUp5arJG3J57NuYig75gzXo58xFC1oW41gBhgDxxvlSf-fDyZ65Vq9dlT-a3ijODdq4_mybRlzlJEFqJqtc0uInRf9pop3fjCWwxBuMmo,ChIJWRs7COJXei4R0NAFl2kjjNU,4.9,32,kota,KOTA YOGYAKARTA,"59PV+J5 Warungboto, Yogyakarta City, Special Region of Yogyakarta",tourist_attraction|point_of_interest|establishment,No,No,Medium,Edukasi|Entertain|Art|Historical,Solo|Family|Couple|Friends,08.00,16.0,-,"Warungboto Wisata adalah sekelompok kampung wisata yang terletak di Kelurahan Warungboto, Kemantren Umbulharjo, Kota Yogyakarta. Tempat ini memiliki konsep pariwisata yang mengedukasi, mengangkat seni, budaya, dan sejarah, sambil memberdayakan masyarakat setempat. Pengelolaan wisata di sini menggunakan sistem cluster untuk menciptakan paket-paket wisata yang berisi berbagai atraksi unggulan. Semua ini berpusat di sekitar pelestarian Pesanggrahan Rejowinangun, yang lebih dikenal dengan nama Situs Warungboto.","Untuk mencapai Balai Warungboto di Yogyakarta, Anda dapat menggunakan kendaraan pribadi atau layanan ojek online seperti Gojek atau Grab. Anda juga dapat memanfaatkan transportasi umum, seperti bus kota, dengan mencari rute yang sesuai. Pastikan untuk memeriksa alamat lengkap yaitu di Balai, Jl. Umbul Raya, RT.38/RW.09, Warungboto, Kec. Umbulharjo, Kota Yogyakarta, Daerah Istimewa Yogyakarta 55164 dan petunjuk navigasi jika diperlukan.",Anda bisa melakukan aktivitas sesuai dengan paket wisata yang diambil.,Balai Pertemuan.Kamar Mandi Umum.Kios Souvenir.Outbound.Spot Foto.Wifi Area.,Kenakan pakaian yang sopan dan sesuai dengan budaya Jawa.Cobalah hidangan khas Jawa di restoran atau warung makan setempat.Selalu hormati budaya dan adat istiadat setempat.
Situs Warungboto,"Jl. Veteran No.77, Warungboto, Kec. Umbulharjo, Kota Yogyakarta, Daerah Istimewa Yogyakarta 55164, Indonesia",-7.8102685,110.3931513,ATJ83zhvAOlnt4Upe27UHw5sgHmU3KRGhkrWDkIioBXhprSPbH42GgreQr7q0XbglN1k8pPWYx8I2BL6zL2fDdUpTQ6gvOEuswYcehjdtRL8piiDCD8xJwLLfJiSG6_PQw4s0p2bTdgJnFxZVwXutmHI6qcmOrFuo6S1OxXVOB2q7DpTEocS,ChIJQ2Jf1G1Xei4RAc8o1F2CxEc,4.4,6095,kota,KOTA YOGYAKARTA,"59QV+V7 Warungboto, Yogyakarta City, Special Region of Yogyakarta",tourist_attraction|point_of_interest|establishment,No,No,Low,Historical|Art,Solo|Family|Couple|Friends,08.00,17.0,-,Situs Warungboto adalah bekas kompleks istana yang dibangun pada abad ke-18 dan menjadi tempat penting selama masa pemerintahan Sultan Hamengkubuwono I. Situs ini mencerminkan arsitektur Jawa klasik dengan paviliun dan taman yang indah. ,"Situs Warungboto terletak dekat Jl. Veteran No.77, Warungboto, Kec. Umbulharjo, Kota Yogyakarta, DI Yogyakarta 55164, yang mudah diakses dari jalan raya. Pengunjung dapat memilih untuk parkir di pinggir jalan atau masuk ke dalam perkampungan untuk menitipkan kendaraan mereka.",menjelajahi bangunan bersejarah. mengambil foto-foto.,Toilet.area istirahat.,"Jika Anda ingin memahami lebih banyak tentang sejarah situs ini, disarankan untuk bergabung dengan tur panduan.Jangan lupa menghormati aturan dan larangan yang berlaku di situs ini, seperti tidak merusak atau mengambil barang dari situs."
Desa Wisata Sungai Code Jogja Kota,"Jl. Lowanu, Rw 16 Mulyorejo, Sorosutan, Kec. Umbulharjo, Kota Yogyakarta, Daerah Istimewa Yogyakarta 55153, Indonesia",-7.822908900000001,110.3756894,ATJ83zgVIBqaSXugRv9r5hBQhoHJhQqX3nZ3RwMowgvPVGuQGyfQwxIY1wni5u7CoAAXsZZV8ROfHYKhax-C0x8TaJRf0glwH05BqU0xUBfSZaH75jd7bgrsr9bZhF0GbEJOCy83-kNtTBDqrZuyT9A0kZC3_w1YbnPFnJBjIQfoM49ijeXr,ChIJ2wBCk6hXei4Rhu62K-Izjrc,4.8,9,kota,KOTA YOGYAKARTA,"59GG+R7 Sorosutan, Yogyakarta City, Special Region of Yogyakarta",tourist_attraction|point_of_interest|establishment,No,No,Low,Entertain|Art,Solo|Family|Couple|Friends,09.00,22.0,-,"Tempat wisata Kalicode adalah salah satu destinasi yang terletak di sepanjang sungai Kali Code. Sebelum berubah menjadi lokasi wisata, Kalicode adalah daerah yang kurang terawat dan kurang terurus. Melihat permasalahan ini, muncul gagasan untuk mengubah tepian sungai Kali Code menjadi tempat wisata yang berbasis komunitas dan meningkatkan pertumbuhan ekonomi masyarakat setempat.","Wisata Kalicode, yang terletak di wilayah kelurahan Suryatmajan, sebelah timur Malioboro di Yogyakarta, dapat diakses dengan kendaraan pribadi atau taksi. Jika Anda menggunakan GPS atau peta, Anda akan mudah menemukan lokasi ini. Alternatifnya, Anda bisa memilih untuk menggunakan layanan ojek melalui aplikasi online populer di Indonesia. ",Berfoto dengan spot foto yang disediakan.Menikmati keindahan desa.,Spot foto.Mural.Tempat Makan.,Pakailah pakaian santai yang nyaman dan sepatu yang sesuai untuk berjalan.Pastikan untuk menjaga kebersihan lingkungan dan tidak merusak alam atau bangunan tradisional.
Yogyakarta Batik Monument,"59X7+HR5, Jl. KH. Ahmad Dahlan, Ngupasan, Kec. Gondomanan, Kota Yogyakarta, Daerah Istimewa Yogyakarta 55122, Indonesia",-7.8011159,110.3646172,ATJ83zhzxsHscO9SaMCgKg9cgVaq0ataxFbNmEoqgWOnXofIHtmPv9PK4lqALUkm7aRPvGON0GitnvHXK-AMgGYSERNoePLfvlMiwe5MF7tJwrArqOGSAMF-e2jh_NXH3wBxRRX_3-dayJ2Laheht-nMAkfNwkXq4NlckAQLEld4Slq68tuq,ChIJZYb5zIhXei4R1DZBDkoxj1I,4.5,221,kota,KOTA YOGYAKARTA,,tourist_attraction|point_of_interest|establishment,No,No,Low,Historical|Art,Solo|Family|Couple|Friends,00.00,23.59,-,"Monumen Batik meruapakan salah satu bentuk apresiasi pemerintah kota Jogja terhadap kebidayaan yang satu ini. Sejarah pendirian monumen batik ini, bermula pada tahun 2009 ketika batik di akui oleh UNESCO sebagai Warisan Budaya Tak Benda.","Alamat Jl. KH. Ahmad Dahlan, Ngupasan, Kec. Gondomanan, Kota Yogyakarta dapat diakses dengan taksi atau ojek dari Bandara Adisutjipto (10 km) atau dari Stasiun Tugu Yogyakarta (1.5 km). Juga, Anda bisa berjalan kaki dari Malioboro (sekitar 1 km).",Berfoto dengan latar monumen.,Area parkir.,Kunjungi pada pagi atau sore hari untuk menghindari panasnya cuaca.Jangan lupa untuk menghormati tempat ini sebagai monumen budaya dengan berperilaku sopan dan menghindari vandalisme.
Museum Sonobudoyo Unit I,"Jl. Pangurakan No.6, Ngupasan, Kec. Gondomanan, Kota Yogyakarta, Daerah Istimewa Yogyakarta 55122, Indonesia",-7.802455800000001,110.3643666,ATJ83ziyOXqN8YtdZL7No6qcOekMS9Rn49W0a-XdoMXOxBnAu4kvjyxArrGeBYVZfexSCeOUQvJrcdzvi5E08DX89tdCckqzhtcsFPodjc-oJU5r-gLe4PR69ySlVgEDBUONVH34IRoj8UAvofZnU4ED_qLfVMhudWJyys8TOXCmhFvbwvC4,ChIJTwoHg49Xei4R7sU-xBpDEJ0,4.8,4326,kota,KOTA YOGYAKARTA,"59X7+3Q Ngupasan, Yogyakarta City, Special Region of Yogyakarta",tourist_attraction|museum|point_of_interest|establishment,No,Yes,Low,Historical|Art,Solo|Family|Couple|Friends,08.00,21.0,Monday,"Museum Negeri Sonobudoyo adalah bagian dari Dinas Kebudayaan Provinsi Daerah Istimewa Yogyakarta yang bertanggung jawab atas pengelolaan benda-benda museum yang memiliki nilai budaya dan ilmiah. Fungsinya mencakup mengembangkan dan memberikan panduan pendidikan budaya, serta tugasnya meliputi pengumpulan, perawatan, pelestarian, penelitian, layanan perpustakaan, panduan pendidikan budaya, dan presentasi koleksi benda-benda Museum Negeri Sonobudoyo.","Museum Sonobudoyo adalah museum tertua di Yogyakarta dan memiliki lokasi yang sangat strategis. Ada banyak cara untuk mencapai museum ini. Museum Sonobudoyo Unit 1 berlokasi sangat dekat dengan beberapa titik terkenal di Yogyakarta, seperti titik 0 KM Yogyakarta, Keraton Yogyakarta, Alon-alon Utara, dan Masjid Gedhe Kauman. Museum Sonobudoyo Unit 2 berada di jalan Wijilan No. 27D (Dalem Condrokiranan), yang terletak dekat dengan pusat kuliner gudeg dan plengkung Wijilan. Akses ke Museum Sonobudoyo Unit 1 bisa dilakukan dari dua pintu masuk, yaitu dari selatan di Jalan Trikora No. 6 Yogyakarta dan dari sebelah utara di Jalan Ahmad Dahlan.",menikmati aktivitas seperti melihat koleksi seni dan benda-benda bersejarah.menghadiri pameran sementara yang mungkin sedang berlangsung.pertunjukan wayang kulit atau kegiatan budaya lainnya yang bisa Anda saksikan.,Toilet.Jasa foto.Musholla.Pemandu wisata.Museum Medical Center.,"Disarankan untuk datang ke museum ini dengan waktu yang cukup, terutama jika Anda tertarik untuk menjelajahi koleksi dengan lebih rinci.pastikan untuk menghormati aturan dan peraturan museum selama kunjungan Anda."
Omah UGM Kotagede Yogyakarta,"Bodon, Jagalan, Kotagede, Yogyakarta City, Special Region of Yogyakarta 55192, Indonesia",-7.8293282,110.3956232,ATJ83zhyTzIOmUXx610zKzqaUjXjhSWbkE9b6r--aM6UXZuVd0eG_qftsXuMaGypmAlnYwRNudzzT414uywjYm_dCAHeHxlkCahVDTLCWntv1Fa-TmP-9vwN9GOHQAgKZR-u6n6Jx7npd35MO4cwXIGrc-0HD3B-sT4IHNoEukT9MEN_1jf8,ChIJVVVVFRRXei4RmR1-Ncx2jik,4.7,232,kota,KOTA YOGYAKARTA,"59CW+77 Jagalan, Bantul Regency, Special Region of Yogyakarta",museum|tourist_attraction|point_of_interest|establishment,No,No,Low,Historical|Art|Edukasi,Solo|Family|Couple|Friends,09.00,17.0,-,"Omah UGM, sebagian dari bangunan yang terpengaruh oleh gempa tahun 2006, kemudian dibeli oleh UGM dalam upaya revitalisasi kawasan budaya Kotagede yang berfokus pada tiga pilar: Komunitas, Kerajinan, dan Kultural. Bangunan ini memiliki susunan ruang yang khas dari rumah tradisional Jawa, termasuk pendopo, yakni ruangan terbuka tanpa dinding yang digunakan untuk pertemuan, bangunan utama yang disebut sebagai dalem, serta pringgitan sebagai penghubung antara pendopo dan dalem.","Untuk mencapai Omah UGM dari pusat kota Yogyakarta, mulai dari Malioboro, arahkan kendaraan Anda ke arah timur menuju Jalan Batikan. Terus lurus hingga Anda melewati SMAK Sang Timur Yogyakarta. Setelah melewati sekolah tersebut, Anda akan tiba di persimpangan besar. Belok kiri ke Jalan Menteri Supeno, lalu belok kanan di persimpangan kedua mengikuti Jalan Pramuka. Di sebelah kiri Jalan Pramuka, Anda akan melihat sungai Kali Manunggal. Tetap di Jalan Pramuka selama sekitar 1 kilometer, dan Anda akan mencapai persimpangan dengan lampu merah. Belok kiri ke Jalan Tegal Gendu di persimpangan tersebut, dan teruslah melanjutkan perjalanan hingga melewati Jembatan Tegal Gendu. Tidak jauh dari jembatan, carilah petunjuk untuk menuju Omah UGM. Anda akan perlu masuk ke dalam gang kecil yang hanya bisa dilewati oleh satu sepeda motor.",Menikmati arsitektur rumah Jawa dan Kota Gede.Berkumpul atau rapat di pendopo yang tanpa dinding.Eksplorasi area sekitar dengan suasana tradisional.,Toilet.Tempat sempah.,"Tidak ada biaya retribusi khusus yang harus dibayarkan di Omah UGM. Pengunjung hanya diminta untuk mengisi buku tamu dan memberikan sumbangan sukarela.Omah UGM juga digunakan untuk kegiatan prewedding. Bahkan, acara pernikahan juga dapat digelar di tempat ini.Sebaiknya gunakan sepeda motor saja karena akses menuju lokasi harus melewati jalanan yang sempit dan tidak dapat ditempuh oleh mobil.Jika menggunakan mobil, kamu bisa parkir di pinggir jalan di depan toko perak kemudian berjalan kaki cukup jauh menuju lokasi Omah UGM."
Ratu Boko,"Jl. Raya Piyungan - Prambanan No.2, Gatak, Bokoharjo, Kec. Prambanan, Kabupaten Sleman, Daerah Istimewa Yogyakarta 5572, Indonesia",-7.7705416,110.4894158,ATJ83zi2CpcVfex0Y2jXmD9vNdT_odlYrnRHxaNFfBG-pBTPy2dvYUwzF6kMzz0cbA3CDdzeMUZ_FZmxnPsSe6LX9SQx18Hmjsjcu4vyyG9Iru5FhkzQN8-8g-w3_8j5jBGvx1Ul91voEH-NGi0bNSMUx2xyyj5lIY-DY4hINOlS4KuZdXjv,ChIJRf5U05Jaei4RW_l2RPFEPxU,4.6,14184,kota,KOTA YOGYAKARTA,"6FHQ+QQ Bokoharjo, Sleman Regency, Special Region of Yogyakarta",tourist_attraction|point_of_interest|establishment,No,Yes,Low,Historical,Solo|Family|Couple|Friends,07.00,17.0,-,"Situs Ratu Boko sebenarnya bukanlah sebuah candi, melainkan kompleks reruntuhan sebuah kerajaan. Oleh karena itu, tempat ini sering dikenal sebagai Kraton Ratu Boko. Nama ""Kraton Boko"" digunakan karena menurut legenda, lokasi ini adalah istana Ratu Boko, yang merupakan ayah dari Lara Jonggrang.","Kota terdekat dari Ratu Boko adalah Yogyakarta, dengan Bandara Internasional Adisutjipto menjadi pilihan utama bagi wisatawan internasional yang ingin mengunjungi Ratu Boko. Akses ke Ratu Boko juga sangat mudah karena lokasinya yang berdekatan dengan Candi Prambanan. Ini memungkinkan penggunaan transportasi umum dari Yogyakarta. Untuk mencapai Ratu Boko, Anda dapat mengikuti jalan Laksda Adisutjipto dan jalan Raya Solo - Yogya ke arah timur. Ketika mencapai persimpangan Pasar Prambanan, ambil jalan ke kanan (ke arah selatan) menuju jalan Prambanan - Piyungan. Setelah sekitar 3 km dari persimpangan, Anda akan menemui penunjuk jalan menuju Kraton Ratu Boko yang terletak di bukit di sebelah kiri.",Menjelajahi reruntuhan istana dan candi yang megah.Menyusuri kolam renang kerajaan.,Toilet.Tempat parkir.Gazebo.Restoran.Mushola.Souvenir Shop.,Bawa air minum dan topi untuk melindungi diri dari panas.
Sekretariat Sementara Museum Pendidikan Dan Mainan Kolong Tangga,"Tirtodipuran St No.26, Mantrijeron, Yogyakarta City, Special Region of Yogyakarta 55143, Indonesia",-7.818723500000001,110.3647195,ATJ83zjksG_BEizyCIEWEapIZl81V_F25Le4ubyQfjN9egh1O8f-uAZqSReEADBjKg7hOJ7z6b5F-SIOJpanbqKm4YBTSrj0MVjbpOccCkNX3P0q1Zb_B9Av7RcWGodXtPoj5a_CICPb_gN-2faGDLf5oZg4S30-VTCNWn1fmnCJfu8PItIA,ChIJ_W6pFoZXei4Ryqj8yZhX3zg,4.3,60,kota,KOTA YOGYAKARTA,"59J7+GV Mantrijeron, Yogyakarta City, Special Region of Yogyakarta",tourist_attraction|museum|point_of_interest|establishment,No,Yes,Low,Historical|Art|Edukasi|Perbelanjaan,Solo|Family|Couple|Friends,09.00,16.0,-,"Museum Pendidikan Dan Mainan Kolong Tangga adalah sebuah museum yang unik yang menggabungkan sejarah pendidikan dengan koleksi mainan klasik. Tempat ini menampilkan pameran yang mengungkap perkembangan pendidikan dan mainan dari masa ke masa, memberikan wawasan berharga tentang perkembangan budaya dan pendidikan.","Alamat Tirtodipuran St No.26, Mantrijeron, Yogyakarta, Special Region of Yogyakarta 55143 dapat diakses dengan taksi atau transportasi umum dari Bandara Adisucipto Yogyakarta, Stasiun Kereta Tugu Yogyakarta, atau pusat kota Yogyakarta. Pastikan untuk menggunakan peta atau bertanya kepada penduduk setempat jika Anda memerlukan bantuan dalam menemukan alamat tersebut.",Jelajahi koleksi sejarah pendidikan dan mainan.Belanja oleh-oleh di toko suvenir yang ada.,Parkir.Area istirahat.Toilet umum.,Periksa jam operasional museum sebelumnya dan pastikan untuk datang sesuai dengan jadwalnya.Patuhi aturan museum dan jangan merusak koleksi yang dipamerkan.
Kampung Wisata Dewa Bronto,"Jl. Sisingamangaraja No.49, Brontokusuman, Kec. Mergangsan, Kota Yogyakarta, Daerah Istimewa Yogyakarta 55153, Indonesia",-7.817442700000001,110.3732733,ATJ83zhIOkNm6JvXrOuMYtUNsS95fa7VlQNpVkPLnrvcS78b-uKcGajMSZcixsC56AgbhZAuHgXS7mKMvtT9fOz1pP_HEkrRH85aE0a9tIIjL5EpxsqL3rT60j5o6CzeXFFvnKkymkXX89D2JbOdAfXEzYC7wPnKCGeYJOLC9hy10DeatFaT,ChIJKzevCL1Xei4R5o4ZiN-pPd8,5.0,6,kota,KOTA YOGYAKARTA,"59MF+28 Brontokusuman, Yogyakarta City, Special Region of Yogyakarta",tourist_attraction|local_government_office|point_of_interest|establishment,No,Yes,Medium,Edukasi|Entertain,Solo|Family|Couple|Friends,09.00,17.0,-,"Kampung Wisata Dewa Bronto adalah destinasi ekowisata sosial yang terletak di sepanjang sungai DAS Code di bagian selatan. Tempat ini didukung dengan berbagai atraksi kerajinan dan seni tradisional. Nama ""Dewa Bronto"" diambil dari nama kelurahan sekitar, yaitu Brontokusuman, yang konon merupakan tempat pemukiman sekitar Dalem Brontokusuman. Menurut cerita rakyat, Dalem Brontokusuman adalah kediaman seorang bangsawan dari Keraton Kasultanan Yogyakarta, yakni seorang putri bernama Gusti Bendara Raden Ayu Brontokusumo.","Alamat Jl. Sisingamangaraja No.49, Brontokusuman, Yogyakarta 55153 berada di pusat kota dan dapat diakses dengan taksi, ojek daring, atau angkutan umum dari bandara, stasiun kereta, terminal bus, dan pusat kota.",outbond.susur sungai.flaying fox,Area parkir.Kamar mandi umum.,Kenakan pakaian yang nyaman dan sesuai dengan cuaca.Berinteraksi dengan penduduk setempat untuk pengalaman yang lebih berarti.
Tarunasura Wijilan Gate,"59W8+FJH, Jl. Wijilan, Panembahan, Kecamatan Kraton, Kota Yogyakarta, Daerah Istimewa Yogyakarta 55131, Indonesia",-7.8038148,110.3666102,ATJ83zjnjX8ltvT_HMJGw-I4CE6bKIxniKctAZp0JA6hvXvFCBJ5paEGobfBk5NSs3pI5PfvsCFQ4V0IGfDM5CMXe1zVVARXcUppRy2pTiCgJOJWnHB8M1XArH012q2AYawhMg1dnmsVevG9VoC_edahdAf0P5aduEW4O2yFitgH5j5AwaTi,ChIJN5Xif4VXei4RYiCfVBhU0lQ,4.7,438,kota,KOTA YOGYAKARTA,,tourist_attraction|point_of_interest|establishment,No,No,Low,Historical,Solo|Family|Couple|Friends,00.00,23.59,-,"Plengkung Tarunasura dinamakan demikian karena pada masa lalu, gerbang ini dijaga oleh prajurit muda. Meskipun bangunan di sebelah kanan dan kiri gerbang ini telah lenyap, Plengkung Tarunasura tetap asli dan dirawat dengan cermat, menjadikannya peninggalan bersejarah yang sangat berharga.Saat ini lebih dikenal sebagai plengkung Wijilan karena letaknya di daerah Wijilan, Kalurahan Panembahan, Kraton, Yogyakarta.","Plengkung Tarunasura (Plengkung Wijilan) terletak di daerah Wijilan, Yogyakarta, di sebelah timur Alun-alun Utara. Akses dengan kendaraan pribadi, taksi, atau ojek online.",Gerbang yang indah ini menawarkan latar belakang yang menarik untuk mengabadikan momen Anda di Yogyakarta. ,-,Pastikan Anda membawa kamera atau ponsel untuk mengambil foto di gerbang ini.Jangan lupa membawa air minum dan makanan ringan jika Anda merasa lapar atau haus.
Kampung Wisata Basen,"Jl. Kemasan No.53, Purbayan, Kec. Kotagede, Kota Yogyakarta, Daerah Istimewa Yogyakarta 55173, Indonesia",-7.824372899999999,110.400465,ATJ83ziR16WpSWNeZiVzVr08WM-annZ2S4ZVyPWuKbUJxjGVXL86DvZYfM33haJPwIZTzFjez24nHDeIVkmBxqg9kmHG228HYewH615xbhG6yv35oNhanwTmPaOgpj0Vo04kUj3az3XD54vVBEW2xf3_xPvU2CU30eAe4agztJ2_uNyGkATP,ChIJySVv5hdXei4R5LPENsNLMcY,4.3,247,kota,KOTA YOGYAKARTA,"5CG2+75 Purbayan, Yogyakarta City, Special Region of Yogyakarta",tourist_attraction|point_of_interest|establishment,No,Yes,Low,Edukasi|Entertain,Solo|Family|Couple|Friends,08.00,18.0,-,"Kampung Wisata Basen adalah sebuah destinasi wisata yang terletak di yogyakarta tempat ini menawarkan pengalaman mendalam tentang budaya Jawa,kuliner dan kerajinan perak.","Kampung Wisata Basen terletak di Jl. Kemasan No.53, Purbayan, Kotagede, Yogyakarta. Anda dapat mencapainya dengan taksi atau kendaraan pribadi, sekitar 30-45 menit dari pusat kota. Aplikasi navigasi seperti Google Maps dapat membantu. Pastikan untuk memeriksa jam operasional sebelum pergi.",Menyantap makanan tradisional Roti Kembang Waru.mengunjungi bengkel kerajinan perak dan emas putih yang masih aktif.,Tempat parkir.Toilet umum.,Cobalah makanan lokal yang lezat.
Between Two Gates,"Jl. Masjid Besar No.905, Purbayan, Kec. Kotagede, Kabupaten Bantul, Daerah Istimewa Yogyakarta 55173, Indonesia",-7.8309721,110.3991855,ATJ83ziWxX5O3P0Y1OU4Pet_EgWq9yIjERCRY9-ai726ItqEvQd-Y9wm3y7kJ7vODDiq31XDIKtm5UYl1cAXgt1iR7o08KsRUhZmGUHzRqIZLL2zof3PIZQBBykdisLRQE89lwccqe3etaV2Q9kmIiNo52vmGYD-KkSEDppeIuYY8JUdQ63V,ChIJe6yf1x5Xei4Rxblo_zUw3E8,4.7,163,kota,KOTA YOGYAKARTA,"599X+JM Purbayan, Yogyakarta City, Special Region of Yogyakarta",tourist_attraction|point_of_interest|establishment,No,Yes,Low,Edukasi|Entertain,Solo|Family|Couple|Friends,07.30,5.0,-,"Between Two Gates adalah area kecil dalam permukiman yang sebagian tertutup karena terletak di antara dua gerbang di kedua ujungnya. Area ini terdiri dari sejumlah rumah Joglo yang terdiri dari bagian dalam (dalem) dan aula (pendhapa), yang tersusun dalam satu baris. Rumah-rumah ini saling berhadapan, menghadap ke arah utara-selatan, dan dipisahkan oleh lorong sempit. Yang menarik, rumah-rumah yang berhadapan ini dimiliki oleh satu pemilik. Rumah utama terletak di sisi utara dan menghadap ke arah selatan.","Anda dapat mengakses Between Two Gates di Kotagede dengan mengikuti alamat berikut: Jl. Masjid Besar No.905, Purbayan, Kec. Kotagede, Kota Yogyakarta, Daerah Istimewa Yogyakarta 55173. Cara terbaik adalah menggunakan taksi atau kendaraan pribadi, dan waktu perjalanan biasanya sekitar 15-20 menit dari pusat kota Yogyakarta. Pastikan untuk menggunakan aplikasi navigasi seperti Google Maps atau Waze jika diperlukan untuk petunjuk arah lebih lanjut.",Menikmati arsitektur dan lingkungan yang khas serta bersejarah.Mengambil foto-foto menarik di tempat yang unik ini.,Tempat parkir.,Hormati bangunan bersejarah dan budaya yang ada di sini.Kenakan pakaian yang sesuai dengan cuaca dan nyaman untuk berjalan-jalan.
Jurang Tembelan Kanigoro,"Mangunan, Dlingo, Bantul Regency, Special Region of Yogyakarta 55783, Indonesia",-7.940067699999999,110.429852,ATJ83zj6GogpwzTQ1dy48TmJi3XpAOxhubzmuhlXEplq0IVZJL5GBV8ges1a3pHLvMdsluvL6JRCY1qxyjmIWqd_Caqi3KU_JtpKNif5DmAbV80qf4S8hXWSvbSUUFXkXJUTS11-mEhLAM0iWMWQXtSn1-t6OJ81ekfIsGhtZJfTAqUCfuqD,ChIJYWmf-l5Tei4Rny4GNmuqTNk,4.5,4142,kota,KOTA YOGYAKARTA,"3C5H+XW Mangunan, Bantul Regency, Special Region of Yogyakarta",tourist_attraction|point_of_interest|establishment,No,No,Low,Nature|Relaxing,Solo|Family|Couple|Friends,05.00,18.0,-,"Jurang Tembelan Kanigoro, merupakan salah satu destinasi alam utama di Kabupaten Bantul yang terletak di Desa Mangunan, Kecamatan Dlingo, Kabupaten Bantul, Daerah Istimewa Yogyakarta, tidak jauh dari Kebun Buah Mangunan. Pilihan waktu terbaik untuk mengunjungi Jurang Tembelan adalah saat pagi sebelum matahari terbit atau menjelang senja sebelum matahari terbenam. Di pagi hari, awan-awan seringkali menghias langit di sekitar jurang ini, menciptakan suasana yang memukau.","Untuk mencapai Jurang Tembelan Kanigoro dari Kota Yogyakarta, arahkan kendaraan Anda ke Terminal Giwangan, kemudian menuju selatan ke Pasar Imogiri, lanjutkan ke Makam Imogiri, dan ikuti petunjuk menuju Kebun Buah Mangunan hingga sampai di Jurang Tembelan.",Berfoto di spot foto yang sudah disediakan.Berjalan-jalan diarea wisata.,toilet.mushola.lahan parkir.gardu pandang.ornamen foto.,"Kenakan pakaian yang nyaman dan sesuai untuk trekking.Waspadai cuaca, terutama saat musim hujan, karena jalur trekking bisa menjadi licin dan berbahaya."
Agro Tainment Wisata Kampung Markisa,"Blunyahrejo, Karangwaru, Kec. Tegalrejo, Kota Yogyakarta, Daerah Istimewa Yogyakarta 55241, Indonesia",-7.774189000000001,110.3647986,ATJ83zgKBnrML1LejYa6UB7ShrTq08o4ik8STW5pdql6puNgQRayi5HzFGPPRWlakCMyRt6C4qKY6sz8p7le3b4IbV7RMe0Ile7c9NsQmkgttkp_UGAVmg4M9e2vNpM98kEIsxFOqkTnLn-PgJPVkrPSIhjJeP6of-fgFAMoZrHw_s9snYWF,ChIJj4NarLdZei4RwY-R2dIJCig,5.0,2,kota,KOTA YOGYAKARTA,"69G7+8W Karangwaru, Yogyakarta City, Special Region of Yogyakarta",tourist_attraction|point_of_interest|establishment,No,No,Low,Edukasi|Entertain,Solo|Family|Couple|Friends,07.00,21.0,-,"Kampung Blunyahrejo, terletak di Kelurahan Karangwaru, Kecamatan Tegalrejo, Kota Yogyakarta, terkenal dengan budidaya markisa yang dikelola oleh penduduk setempat. Oleh karena itu, kampung ini sering disebut sebagai 'Kampung Markisa'. Di lahan seluas 4000 meter persegi ini, mereka mengembangkan bibit markisa yang dipelihara dengan baik, dan saat waktu panen tiba, warga di sekitarnya dapat memanennya untuk dijadikan sirup dan minuman markisa.","Akses ke Kampung Markisa, Yogyakarta dapat dilakukan dengan taksi, mobil pribadi, ojek, atau angkutan umum menuju Karangwaru atau Tegalrejo, diikuti dengan perjalanan singkat dengan ojek atau berjalan kaki. Pastikan menggunakan alamat yang tepat dan navigasi jika diperlukan.",Tur Kebun Markisa.,Area Parkir.Toilet.Mushola.Spot foto.,"Kenakan pakaian yang nyaman, sesuai untuk berjalan di kebun.Bawa topi, kacamata hitam, dan sunblock untuk melindungi diri dari sinar matahari.Ajak keluarga atau teman-teman untuk lebih seru."
Maritime Museum - Jogja,"Jl. R. E. Martadinata No.69, Wirobrajan, Kabupaten Bantul, Daerah Istimewa Yogyakarta 55182, Indonesia",-7.801130299999999,110.3493043,ATJ83zjZIrgGgq27G_R6aePJ8UNfZrx_OVtgdYdsyc6IipnsBY7S-yKbgc3Xsm8FzmELWQXIBY8ftIW8ZCfq_VWbYZDoFFQvEm9T99LjcQ8QhCc9wX7LOYb82Z_zpHKRTVfN-wN9PQFyC5487Kwf7eQRBsrz5cHi0vzME135S4TmkLGiSvso,ChIJEVkmj_RXei4RqCYQIG4hc0M,4.4,216,kota,KOTA YOGYAKARTA,"58XX+GP Wirobrajan, Yogyakarta City, Special Region of Yogyakarta",museum|tourist_attraction|point_of_interest|establishment,No,Yes,Low,Edukasi|Entertain|Historical,Solo|Family|Couple|Friends,08.30,16.0,Monday,"Museum Bahari didirikan pada tahun 2009 oleh Laksamana Madya TNI Didik Heru Purnomo dengan maksud untuk menyebarkan pengetahuan mengenai hal-hal yang berkaitan dengan dunia maritim. Fasad museum ini menarik perhatian dengan desain yang menyerupai pusat komando kapal. Di dalam museum, Anda dapat menemukan beragam koleksi yang berkaitan dengan kehidupan laut. Beberapa contoh koleksinya termasuk senjata meriam, torpedo, model kapal perang miniatur, peralatan TNI, dan banyak lainnya.","Museum Bahari Yogyakarta terletak di alamat Jl. RE Martadinata No. 69, Wirobrajan, Yogyakarta. Lokasinya dapat diakses dengan kendaraan pribadi, taksi, atau ojek dari pusat kota Yogyakarta. Museum ini berjarak sekitar 30 menit dari pusat kota.",Eksplorasi Koleksi museum.,Area Parkir.Ruang Koleksi dan Souvenir.Pemandu.,"Museum ini paling baik dikunjungi saat pagi untuk menghindari keramaian.Jika Anda ingin mendapatkan pemahaman yang lebih baik tentang sejarahnya, disarankan untuk menggunakan pemandu."
